review,sentiment_label
Camera is averageREAD MORE,negative
Brand is brand Samsung is grandREAD MORE,positive
BrilliantREAD MORE,positive
Camera needs to improve.READ MORE,negative
Head set was not in boxREAD MORE,negative
Very good performance in last 9 days. Battery  backup is good.  Both side Camera are awesome. Very good build up. Back Cameras are not coming out from body this design is very impressive. Doesn't need a back cover because it's not slippery.READ MORE,positive
Side finger prints can be cool but mobile hang too much while playing hd video and touch sometimes don't work.READ MORE,negative
"I feel i have been cheated by flipkart in exchanging my old lenovo k 8 phone for buying samsung galaxy 22. They pay very immature price at the time of physical exchange. U all be careful in the matter of exchanging your old phone with flipkart. And flipkart ,. Please don't do this sort of fraudulent practice. It defame your popularity and credibility in due course.READ MORE",negative
Beter one for andriod lovers..reasonable price f22 over all gu👌READ MORE,positive
Good product with poor deliveryREAD MORE,negative
Nice one by samsungREAD MORE,positive
Best and value for moneyREAD MORE,positive
"A very good phone in this price Range, Surely its value for money.👍🏻👍🏻READ MORE",positive
Didn't charge with our company product  adapter and USB cable..i checked another adapter and USB cable charging mobile.Replacement parcel that problem slove got new mobileREAD MORE,negative
"Suddenlly phone noising, and it's not super amled displayREAD MORE",negative
Oms mobile this price rangeREAD MORE,positive
"Have been using this phone since 6 months. I am not a gamer or very heavy internet user. Just normal Googling, occasional social media use, live streaming when India cricket match.. these are my routine works.PROS:1. Battery is awesome it lasts 1.5 days without charge.2. Display is awesome.3. No lags and switching between apps is smooth.CONS:1. Camera is below expectations. If you want clarity and effects as shown in ads of Samsung phones always opt for 64 mega pixels or higher. This ph...READ MORE",positive
"This is useless mobile for high end users. Pros - Battery, somewhat display & Android 11.Cons - Cheap mediatake processor, plastic body polycarbonate. Single speaker. No 4g + network,Chinese mobile like camera, delicate sim tray, so much bloatware default consuming 2 GB ram out of 6 GB. No corning gorrila glass. In box 15 wat adapter with useless 2 feet cable, in this mobile all Chinese materials is used on the name of  samsung. *Cleaver people don't go for it !!!READ MORE",negative
Facing OS IssuesREAD MORE,negative
"Absolutely not satisfied with the performance, always network issues, call connectivity problem, and processor is thirdclass.Waste of money.READ MORE",negative
"Bad mobile ever from my experience,  after just 5days use it's started freezing problem,  i cannot take even at least any phone calls, the display not showing anything...    and i tried to replace it, they refused and says  if the problem is under software complaint they cannot replace it...  wwow what a replay... Don't buy this product anyone...READ MORE",negative
Getting struck and even can't switch off mobileREAD MORE,negative
Phone samsung galaxy f22 flaunts goodREAD MORE,positive
"Variant: (6GB Ram, 128GB Storage).1. Poor battery backup (only 5 hours ) for normal phone user Without gaming.2. Battery drains fast in Idle condition also.2. Screen flickering.3. Touch panel stops working most of the time. Totally disappointed with the product. Waste of money.READ MORE",negative
OkREAD MORE,positive
"One of the best mid range phone with great camera quality, display and battery performance. Battery is the USP of this phone and camera is equally good for a phone of 10k-20k range. As usual of No compromise with display. Overall a great buyREAD MORE",positive
Excellent product &Camera more filtersA one battery backup ☺️READ MORE,positive
"Compared to other brands like Mi, Realme etc. Samsung Galaxy f22 is a good phone at this price. Selfie camera isn't that great. Battery life is just awesome. Sometimes I only need to charge once in two days.READ MORE",positive
Network is worsen. Suddenly network vanishes. Then need to restart the phone.Overall operation is too much slow.READ MORE,negative
It is a very nice phone.READ MORE,positive
Best fone at this price range...also additional point I give  for auto call recording function (without notifying other person)...READ MORE,positive
ExcellentREAD MORE,positive
"Review it after 6 months of using.After 3days of using it suddenly hanged,and i cannot switch off as well. After 2hours of fighting with new phone phone was off then i after factory reset it runs properly for 3months. then again same problem arises. Now i slove it same style. last 100 days it okay.Camera,batery good.READ MORE",negative
Phone is very goodREAD MORE,positive
NiceREAD MORE,positive
Network issue don t buyREAD MORE,negative
It's far better then China made mobilesREAD MORE,positive
"Very nice device, I'm using from last 15 days, as of today no problem. Totally camera and battery life is too good. Most recommended device. I brought 2 device... both working fine. Value for money in this budget.READ MORE",positive
Good qualityREAD MORE,positive
Product si good with this price range.But samsung need to improve the processor..READ MORE,positive
Over all goodREAD MORE,positive
Jio sim does nt work overall phone is awesomeREAD MORE,negative
Not goodREAD MORE,negative
Good so farREAD MORE,positive
Not full HDAverage screen & cameraREAD MORE,negative
Waste of moneyREAD MORE,negative
"The device is good, expect FHD+ display in this price range.Battery is very long lasting, Camera was also good.READ MORE",positive
Value for money that's it. Though camera could have been better if f1.7 aperture was used instead of f2.0READ MORE,negative
Very good phone for the price.battery performance is very good. Good camera and overall good for normal using.READ MORE,positive
"Best phone under this range by Samsung, value for money.  I am using this phone by 15 days  find better performance and battery backup. Here i got one problem  net connection speed indicator is not available. So what u will be fee I don't know but feel a bad performance to taking it.READ MORE",positive
camera too badREAD MORE,negative
"I have 2 redmi phones both 5000 mah,specifically I brought a.samsung because of.battery back up 6000 mah,but device and charger both heating problem,what should I do?I can't suggest for samsung mobile,thank.youREAD MORE",negative
GoodREAD MORE,positive
All type of facilities are goodREAD MORE,positive
The Charging time for this phone take very much time 2-3 hours for full chargeREAD MORE,negative
SupprREAD MORE,positive
This phone may not be real Samsung Galaxy F22. I cannot see the IMEI No. by dialing *#06# and it is observed that the phone is not easy to use.READ MORE,negative
This phone is amazing but i prefer you to buy 4GB RAM & 64 ROM in this model.Phone is Amazing...READ MORE,positive
