review,sentiment_label
"AwesomePros:-1) no heating issue 2) no hanging issue3) No lags in games & application4) awesome power backup👌👌5) display vere level(u can confidantly make compatition with other 50000 range phones, you ill win6) accessories are easly available bcs m30,m31, f22 all are in same bodyCons:-1) littlebit heavy(6000mah battery)but comfort to me2)No dual Bluetooth connetivity, most of Samsung phones have this special feature..3)Don't have torch light shortcut, always need to unlock the...READ MORE",positive
"Product is  good , back camera  is very good,  &  front camera is   ok ok . and battery backup   also  good . overall product is nice .READ MORE",negative
Extremely display badREAD MORE,negative
In dual Sim one sim workingREAD MORE,positive
Value for moneyREAD MORE,positive
"If you clearly know the specifications which the device offers, then most probably this device is going to satisfy your expectations. Highlights-1.battery backup is great. I'm an above average user (doesn't play pubg, outdoor use so the brightness will be set to the end of the blue bar.) and i only charge this device only once in two days.2.90hz refreshing rate of the display makes my interactions smoother it is a satisfactory experience. 3.actually you don't have to use the power butt...READ MORE",positive
"Nice buy . Writing after using 1 week , camera is good , battery life is great last 1.5 day , performance is good. Good buy at this priceREAD MORE",positive
"Processor working poorly,heating issueREAD MORE",negative
Nice phn in this range affordable priceREAD MORE,positive
Very good mobile warking a.t.zREAD MORE,positive
It's battery is very powerful nice brand. I am happy with delivery boy I am satisfied with his behaviour his behaviour was very nice  good battery But it's camera is not so good .Overall mobile is good you can purchase..Thank you flipkartREAD MORE,positive
"Hey!I purchased this ph in March anD reviewing it now,Money worth spending, I was in dilemma btw REALME NARZO OR F22,trust me f22 is far better than narzo in terms of looks, camera,battery and speed, I'm telling this cuz my sis brought narzo and she regrets it...so u can go for f22 in given budgetREAD MORE",negative
Nice product 😊READ MORE,positive
Overall good product... I will update my review after few months of usageREAD MORE,positive
Good product in this price 👌READ MORE,positive
Great deal at this price pointREAD MORE,positive
Nice phone at this rangeREAD MORE,positive
Per day once mobile will hangREAD MORE,positive
This is a defective product. Camera is very bad quality and not as other Samsung phone. This is my 5th Samsung Mobile but I have experienced very bad with this product.READ MORE,negative
Very badREAD MORE,negative
Bought this in quick delivery... Display is not working after 8days.... No response from customer care....poor service... Don't buy anything in quick....better go to the shop .. they respond properly.... 13k wastedREAD MORE,negative
Great performanceREAD MORE,positive
"Good Budget phone , It is better for Mom , Uncle , Grandpa and Grand maa , those who don't need so much of technology, or for those who just use Android phone that's it apart from that they don't care what ram , camera and etc features it has. Budget phoneREAD MORE",positive
Very low class i think that no classREAD MORE,negative
Not goodREAD MORE,negative
Very poor performanceREAD MORE,negative
"Very worst product, display is very poor quality, dont buy this mobileREAD MORE",negative
Nice mobile iam full happyLove u ❤️flipcart❤️READ MORE,positive
Good phone 📱READ MORE,positive
Nice product at this price. I love this phone. Camera-10/10Display-10/10Processor-7/10Battry-9/10READ MORE,positive
Nice mobileREAD MORE,positive
Superb performance 👌Best quality product of Samsung in this price.READ MORE,positive
Everything is perfect with this phone.One thing I am highly disappointed with the video resolution.It should be high resolution.Otherwise it's perfect.Rasy to use.Camera also good.Display should be 6.7 inch.But after all if you spend some.extra money I must refer to buy F62.Its awesome phone from samsungREAD MORE,negative
Super looks good & super fast deliveryREAD MORE,positive
CAMARA QUALITY IS VERY POOR NOT AS EXPECTEDREAD MORE,negative
network problem  😒 big problem this phoneREAD MORE,negative
Love this phoneREAD MORE,positive
Overall good performance and good battery lifeREAD MORE,positive
Quite satisfied with this phone. Value for money in this price range.READ MORE,positive
Nice phone in that price rangeREAD MORE,positive
Nice phone..good battery backup...READ MORE,positive
Very bad experience with Samsung galaxy I thought there will be some change will come in this product but there is same issue in all Samsung galaxy product is common for battery charging why Samsung is not working on it there is very slowness in charging and mobile is also getting heatorw even we keep in off mode.READ MORE,negative
"Poor Camera Quality, I have to replace the phone due to this.Thick and Bulky compared to other Galaxy devices.Performance is Ok.READ MORE",negative
Heating issue not resolved. While tech visited battery temp is 32 and battery percentage is 82%. After 30 minutes charge 33.9 and 100% battery. To charge 18% battery it took 30 minutes and raised temp by ~2 degree. You people don't see the problem.READ MORE,negative
Beast mobile Their is issueREAD MORE,negative
"Very Good phone for Daily users and Casual Gamers it  so smooth and the super Amoled display is just great and the Battery and the Camera are also great.If anyone is looking for a Camera, battery and display centric phone this is the best you can get at this price range.READ MORE",positive
GoodREAD MORE,positive
Display is not good as per price of 15k....camera is average....not happy as per 15k....READ MORE,negative
Good qualityREAD MORE,positive
SuperREAD MORE,positive
One of the best mobile.. Samsung mobiles always best mobiles when compared to another mobiles...best performance superbREAD MORE,positive
Don't waste money pls don't buy this phoneREAD MORE,negative
This is the best samsung phone under 15k ... Overall a nice samsung phone.READ MORE,positive
All things  is perfect value for moneyREAD MORE,positive
Good mobile with nice interface. Selfish cam is OK OK. Battery backup is good. Screen has shown bright colors attractively. Gaming is average but not weaken also. Flipkart delivery has been late by 1 week otherwise no complain.READ MORE,negative
Wrost item and supportREAD MORE,positive
Worst phone ever 😒READ MORE,negative
Worst camera performance. Not recommendedREAD MORE,negative
Very goodREAD MORE,positive
At this price samsung launch the best model .Battery backup is nice ..every quality is good ..awesome product ..auto call recording facility also very good ...clear voice catch ...READ MORE,positive
"It's like literally value for money I totally recommend it you should buy it without any doubt if your budget it tight. Because it's camera is ok not that great but yes it's good, it's battery is awesome and it takes around 3 hrs to full charge ik it's a lot but it runs around 9hrs of onscreen time and that's so good. Overall it's a great phone and a value for money product.READ MORE",positive
Worst phoneREAD MORE,negative
Very Good product my samsung galaxy f22 smart phoneREAD MORE,positive
Camera clarity is super...But I use s9 plus beforeCan't compare with it..s9 plus have only 12 m.p dual cam..but it is  awesomeUsing flash images are yellowish No other complaints Volume buttons sounds feeling like a low quality productSpeaker is averageBattery is awesomeTotal look  this phone is amazing comparing with other brands like OPPO vivo redmiSee my click using flash...READ MORE,positive
Samsung mobile Not good prefer Other brand mobile samsung customer care is not goodREAD MORE,negative
Good mobile but camera can be betterREAD MORE,positive
Display and camera very poorREAD MORE,negative
"Awesome  smartphone  by Samsung..... Value for money...Good display, Good Battery Performance, Excellent  Camera and best user interface .....READ MORE",positive
"Hi,  This is very Bad product , Camera and display is very poor quaility..im going to cancle my order...READ MORE",negative
AmazingREAD MORE,positive
Overall the build quality of the product is good. Camera is decent and the display feels pretty smooth and immersive. The battery will last for more than two days on an average use.READ MORE,positive
"Writing the after using one week,Good camera and battery  backup, am using 1st time samsung , as a pervious user of redmi Lenovo Motorola ,samsung battery backup is good, May be you can get 5G phone at this rate now, But still your looking  for good branded phone, You can go with this .READ MORE",negative
Touch stopped working after 10 days.READ MORE,negative
Good  conditionREAD MORE,positive
"I got it for my Father. He liked it. The performance has been so far good. Good battery backup, no lagging, easy to hold, not at all bulky. Overall a great product from Samsung.READ MORE",positive
"Within 10 days, 3 Times goes to services..1st automatically on ,off the display2nd apps are automatically open and running3rd volume automatically increase and decreaseVery very worst phone..READ MORE",negative
I am writing this review after using 10 days. The battery back is amazing.  But the camera quality is poor. Dispaly quallity is good. And the processor speed is not much.If U r not a gaming lover than this phone is ok for you. But u must have taken this phone  with in 12700 rupees. Not 14449.READ MORE,negative
"Much better products are available at the same price. Did a mistake by ordering Samsung. Features are poor and outdated. Realme, Xiaomi are offering much better products at this price. Samsung mobiles are becoming patheticREAD MORE",negative
Phone is good but slow charging.. Also no back case.. Since it's New phone no back covers available.. No front sticker too.. Better while order.. Order those too.. I thought they will give back case Atleast..reviews on first week let's see how it goesREAD MORE,negative
Please  don't  buy this mobileAfter 5 day use touchpad not work properly And some app not work properlyREAD MORE,negative
Display quality is bad and did not enjoy even small phoneBattery not goodCemera quality averageREAD MORE,negative
SuperbREAD MORE,positive
Display is very average....with amoled display we are not expecting very cheap viewREAD MORE,negative
Worst mobile ever I used....it's really tough to decide which is more Worst flipkart or this mobile huummmm both r WorstREAD MORE,negative
Camera clarity very niceREAD MORE,positive
Fast processor nd nice looking..iam Fully satisfied samsung f22..😊READ MORE,positive
The best mobile within this rangeREAD MORE,positive
GoodREAD MORE,positive
GoodREAD MORE,positive
Over heating toch also not workingREAD MORE,negative
SuperREAD MORE,positive
Mobile is very super but design very poor any improve designREAD MORE,negative
"For all those who are saying phone hangs etc, I would say it's not true. Phone is amazing and almost equivalent to samsung galaxy s20 plus features as I was using this phone feature. Camera is decent and the best part is the battery backup. I am not a heavy game user but watches lot of movies and still battery has never come down below 40%. Overall value for money.READ MORE",positive
Don't buy this phone cemra or phones was very slowREAD MORE,negative
Not work properly easily get hang in some timeREAD MORE,negative
"Somehow 2nd sim is not working.., we have remove the sim n put it back oftenREAD MORE",negative
I am disappointed.worst phone I have purchased ever.Even calls are not properly receivedREAD MORE,negative
"Bought under 13k. After 5 days of use, performance is great. Battery is excellent. Front camera is not at par with other brands in same price. Overall, if you want a phone for calls and internet use, a samsung mobile under 15k with 6/128GB is great deal. Go for it.READ MORE",positive
SatisfiedREAD MORE,positive
Nice phoneREAD MORE,positive
Just go for it blindly.READ MORE,positive
goodREAD MORE,positive
Slow over hitting problemREAD MORE,negative
Best mobile phone but look poorREAD MORE,positive
Camera is good for this rangeREAD MORE,positive
I'm using it over 5. It is a good product to useREAD MORE,positive
"Amazing product. Excellent camera, battery, and other performance. Quick delivery. The only thing that I find disappointing with samsung cameras, is it's huge watermark. However, you can always disable it. Overall an excellent phone. Go ahead!READ MORE",positive
Mobile is very much slow..READ MORE,negative
Nice battery backup and display also pretty goodREAD MORE,positive
"Overall ah sollanum na.. mild usage ku vangalam.Office person , travelling person naa adhigam ah game 🎮 velada maatan na vangalam... good battery 🔋 backup. Ifu are going for gaming then vera choice pakalamREAD MORE",positive
Awesome phone but weight is to highREAD MORE,positive
NiceREAD MORE,positive
Does the job. Good phone for the price. Battery backup is excellent. Camera could have been better as one would expect from samsung and also the refresh rate could have been 120 Hz instead of the 90 Hz that they give.READ MORE,positive
Best camera 📷....👌👌Battery backup is very good👍👍I'm very happy Samsung is the best Thanks SamsungREAD MORE,positive
"Awesome products, nice prizeREAD MORE",positive
"Super...Battery is very good,Camera is nice...Samsung provides best software experience...READ MORE",positive
"1. camera is good, but could be better.2. Volume buttons are too hard.3. Battery backup is quite well.4. Connectivity is good.5. Weight is adequate.Overall value for money.READ MORE",negative
"The camera zooming is very blur, camera not good,  processor is fast,  finger sensor is good,  voice call is good, interface is good, can buy, if you are interested in taking photosREAD MORE",negative
I love Flipkart I love Samsung so beautiful camera and product....READ MORE,positive
"Okayish performance, sometimes lags in performing simple tasks.READ MORE",negative
I am not satisfied with the mobile because I was using Samsung mobile since 7 years first time I got disappointed with this product mobile clarity is not yet all good sound also is problem if we get calls not able to hear charging is also very slow and Wi-Fi connection also not connecting fast as per me itrsquo;s not preferable to buy this mobileREAD MORE,negative
Overall good phone with nice specs but battery is not as per expectationREAD MORE,negative
goodREAD MORE,positive
Sreen Automatic damege and increase every day wasteREAD MORE,negative
Waste of money phone was very slow and sometimes it's stuckingREAD MORE,negative
Product is good ..Battery 🔋 is very goodREAD MORE,positive
Nice picREAD MORE,positive
Music player problem & sond of the mobile speakers is low ....READ MORE,negative
"Product is best valu for money but just problem net  work  problem, Ander is bestREAD MORE",negative
Budget phoneREAD MORE,negative
AvarageREAD MORE,negative
Value of moneyREAD MORE,positive
Nice phone.READ MORE,positive
Camera quality is Good Battery also GoodREAD MORE,positive
In this budget....it's a nice phone....full value of money....super display with full brightnessCamera is also good in this price rangeBetter than any China phone.But delivery boy was very rude.READ MORE,positive
Nice product...READ MORE,positive
best phoneREAD MORE,positive
best phoneREAD MORE,positive
GudREAD MORE,positive
If you are a normal user go for it its awesome device by Samsung in this price rangeREAD MORE,positive
SuperREAD MORE,positive
GoodREAD MORE,positive
It is a good one and getting good battery  backupREAD MORE,positive
Good phone.. I am using this phone from Last 1 year .READ MORE,positive
Used 1 month. Excellent mobileREAD MORE,positive
Samsung each segment phone is value for money with added benefits of the camera modules and new and stylish designs....READ MORE,positive
Fabulous awesome model very highly worth for money thanks for offer rate given from filpkart😍READ MORE,positive
Very goodREAD MORE,positive
Its been a nice experience. Best if somebody wants to go for ONE UI experience.READ MORE,negative
OkREAD MORE,positive
best deal in low bugute segments ideally best perfom & ilike this Samsung phone I advise all of Samsung customers purches this type 👌READ MORE,positive
GoodREAD MORE,positive
To goodREAD MORE,positive
Very nice mobile value of money .. battery backup is very good. Also lite waight mobileREAD MORE,positive
After 6 gb ram it hangs and also very laggy..heating problem is also thereREAD MORE,negative
ExcellentREAD MORE,positive
Best Option from SamsungREAD MORE,positive
Very good products value for money 👌READ MORE,positive
Nice phoneREAD MORE,positive
Excellent ..READ MORE,positive
Very nice phone... great value for money 👌📱READ MORE,positive
Nice phone gifted to my mom...READ MORE,positive
"Mind blowing purchase.. l bought it in December and now it is July...happy to say that I could not find any issue regarding this phone....samsung has done very good work about this phone. It's camera, battery, display superb..performance is very good..I get android 12 update ..and it runs very smoothly.. I suggest every one if your budget around 11-14 thousa then you definitely buy this handset.. no complain , no issue only satisfaction....Thank you my love it is because of you...READ MORE",positive
Nyc smartphone ... With my mom's birthday..READ MORE,positive
"Good performance , perfect pic ,READ MORE",positive
48 +8+2+2 camera 📸 is v.goodREAD MORE,positive
Best budget mobile ever......💖READ MORE,positive
"Amazing Camera 😍Biggest Battery 🔋Best For BGMI 😱Awesome Display with 90hz 👌All Over Love This Mobile, Just Go For It At 12500 😍READ MORE",positive
"Mobile is Good, Back Camera 📷 Nice, But Selfie 🤳 Camera ok okREAD MORE",negative
Phone is very heavy. Cannot hold for long time. Rest everything is ok.READ MORE,negative
1.Heating Problem 2.Privacy lock is not provided 3.Screen size appears a little bit small3.it weighs more4.Front Camera is not good Remaining  Features are goodREAD MORE,negative
Very nice phone in this budgetREAD MORE,positive
Value for moneyREAD MORE,positive
"Camera quality is good, and the performance, display, battery are too good. Happy with this Product.READ MORE",positive
Got updated to Android 12 and One UI Core 4.1.READ MORE,positive
The battery back up seems poor and charging time is little bit moreREAD MORE,negative
Battery life amazing❤️READ MORE,positive
GoodREAD MORE,positive
Everything is Superb About this PhoneREAD MORE,positive
Best option for medium users Display is very nice Battery backup is awesomeBack camera quality super Front camera averageREAD MORE,positive
Worth For Non game users . this model is worth for money.but don't Buy adds on like Mobile cover and temper glass.because mobile will deliver in 2 days but other product takes time 15 days timeREAD MORE,negative
Samsung is a king of all kingsF22 in mind blowing purchaseREAD MORE,positive
Cheap and Best 👌READ MORE,positive
Value for moneyREAD MORE,positive
"Except Network,  all is wellREAD MORE",positive
Terrible experience…screen is not responding to touch after three months of usage…that too when the phone is used only to make calls mainlyREAD MORE,negative
Honest review after using two days.Display very smooth. 90Hz awesomeCamera good.Batery backup outstanding.Phone performance very good.Overall this phone is very good in range of 13k-14k.One can go buy without delay.But one problem is.- charging time taken much more campare to other brands.No back cover provided.Thank you flipkartREAD MORE,positive
Network issueREAD MORE,negative
Medium range phone for fathers and mothersREAD MORE,positive
After Somedays my display not working 😕READ MORE,negative
•Camera is Ok at this price point . •Battery backup is awesome. •Display is very nice at this price point.•But this is a great regular use phone.•Dont take it as a performance segment phone or for the purpose of gaming and stuffs. Its not ment for that . You will definitely be disappointed at some point if you expect high performance from this device.READ MORE,negative
Osm phoneREAD MORE,negative
Amazing phone!! After using it for 4 months.. I conclude..* camera quality is almost good.. * battery is superb.. you need not care for full 2 days.. once it's fully charged. * storage and processor is also almost good( I didn't faced any problem) * feel in hand is awesome..* but in this price.. camera could be more better!!READ MORE,negative
Phone is hanging without much use within 4 months of purchaseREAD MORE,negative
Amazing mobi❤READ MORE,positive
Very valuable mobile 🙂READ MORE,positive
Does not support screen recording.READ MORE,negative
"All over the cell phone is great just the camera needs to be improved a bit most importantly the front camera.Great battery ,great performance , doesn't lags at all .I am using this phon for 3-4months , doing 5 hours online  classes ,playing games , watching web series, I recommend  everyone to go for it .READ MORE",positive
Dont buy the mobile.. Restart Issue.. Average camera quality.. battery is very goodREAD MORE,negative
Once struck for 20 sec but otherwise excellent in all areasREAD MORE,positive
Amezing Android phone !READ MORE,positive
Nice picREAD MORE,positive
I'm giving this review after 8months use. Camera - camera quality is okay. 48mp primary is good. (4/5) Display - Samsung doesn't compromise their display. Amolate display and it's good. (5/5) Battery - Good battery life. It's runs 2-3 days comfortably for basic use and 1 day for gaming. (5/5) Performance - Performance is ok. Don't expect a huge gaming performance from Samsung's lower mid range device. (4/5) Value for money - At 12999 price it's very good. Not good for gaming. But fo...READ MORE,negative
Very smart looking mobile.. Very smooth working.. Very nice and very beautiful..READ MORE,positive
Super collection.. many many thanks for sharing right information to take the decision for purchaseREAD MORE,positive
Very nice mobile very reasonable priceREAD MORE,positive
Good productREAD MORE,positive
Worth for moneyREAD MORE,positive
My fingerprint sensor not working properly after 6 monthsREAD MORE,negative
Volume is less...touch is also a bit problematicREAD MORE,negative
The phone is good for an average user but for a heavy user the phone lags and moreover the screen is also not Amoled and tbe camera is not too good a decent camera wich under performs and dissapoints in low light conditions.READ MORE,negative
Super product from SamsungREAD MORE,positive
Pubg playing very smoothREAD MORE,positive
GoodREAD MORE,positive
Battery is awesome 👌 camera 📷 is goodREAD MORE,positive
all is well.camera 4battery 4.7display 4.5overall 4.4READ MORE,positive
Good performanceREAD MORE,positive
Very nice phone 👍👍👍👍👍👍👍READ MORE,positive
Nice phoneREAD MORE,positive
niceREAD MORE,positive
Get to know after few days the screen is curved while tried to fit tempered glass and also there is network issue in the phoneREAD MORE,negative
BestREAD MORE,positive
"Please do not buy Samsung mobiles ,they are struck frequently, but battery is OK, camera is OK and overall  performance wise it will be not satisfactoryREAD MORE",negative
Nice phone..READ MORE,positive
Superb 😘😘READ MORE,positive
SuperREAD MORE,positive
Value of money this range Good performanceREAD MORE,positive
Wonderful device 👌 👏 But camera performs bad in low lightProcessor is decent Can run COD in medium settings And yes a great battery and value for moneyREAD MORE,negative
Budget  worthy phoneREAD MORE,positive
Battery is very goodREAD MORE,positive
"I bought this mobile recently.  This is a fresh change if you are bored with redmi note mobiles .I like this mobile. But be careful when you are setting up this mobile. Samsung can load your mobile with unwanted apps and softwares. Camera , performance  , display more or less equal to redmi note mobiles.READ MORE",positive
Best phone at this price.. value for money.. awesome display..READ MORE,positive
Awesome 😊READ MORE,positive
Good  performance  thanks  to  flipcart  Good sarvecREAD MORE,positive
Best phone ever I had. Smooth and best display.READ MORE,positive
Except for the display everything else is good for the price. Display looks pixelated. Otherwise its a bargain for the priceREAD MORE,negative
Network issues..Any sim in the slot will work only for few minutes after that callers gets out of coverage area..Despite network is shown in the mobile.READ MORE,negative
It's nice product . I love itREAD MORE,positive
"Awesome phone,super duper awesome batteryREAD MORE",positive
Very nice phone at this priceREAD MORE,positive
Good product.READ MORE,positive
Excellent mobile. RecommendedREAD MORE,positive
GoodREAD MORE,positive
"Nice phone with very good display quality, battery back up also goodREAD MORE",positive
Very nice phone. Battery back up is awesome. Camera is good. Overall performance is excellent.READ MORE,positive
I love this mobile.its very very good  .camera quality is very niceREAD MORE,positive
Worth for moneyREAD MORE,positive
Good mobile low price mobile but it us user kindly mobile love you samsungREAD MORE,positive
Very good battery life.READ MORE,positive
"It's a value for money product. On this price , galaxy f22 has  better performance than other smartphones.While cleaning the app page ,there are some little bit frame drops. But by considering all performance,it's totally best smartphone under 150000 thousand ...READ MORE",positive
SuperREAD MORE,positive
Charger wire is too ShortREAD MORE,negative
Hang ProblemsREAD MORE,negative
More weight is there.!READ MORE,negative
Awesome.READ MORE,positive
GoodREAD MORE,positive
"Cemara performance bad, front camera very badREAD MORE",negative
