review,sentiment_label
Good 👍READ MORE,positive
Great mobile in this price. Display is brilliant and camera quality also nice. Battery backup is good. Overall it's a excellent mobile.READ MORE,positive
Over all mobile good I'm  giving  4 /5 Because  mobile charger  very small one Samsung  please arrange  some good chargers as wellREAD MORE,negative
Good product for minimal usageREAD MORE,positive
I just give it to my wifee ..she liked it.by the way she loved chinese food only. Image shows Gorilla Glass required.READ MORE,negative
I take phone 2 months before I review.  Phone is awesome. Camera @ battery backup superb 👌READ MORE,positive
"Speaker loudness is Ok okzDisplay 8 /10Performance 7/10 (no lag, no ads best experience)Battery life 10/10Look 7/10READ MORE",negative
Very good at this price from the brand SAMSUNGREAD MORE,positive
Good  👍👍READ MORE,positive
It's handling easy and looking good performance is well display battery ok over all good price and worthREAD MORE,positive
Thanks flipkartREAD MORE,positive
Nice product...👍👍READ MORE,positive
Great camera and great phoneREAD MORE,positive
Verry good productREAD MORE,positive
Nice phone in the Sub 15K category. Pros:Overall design and build. Weight of the phone is balanced and is at correct size and width.Smooth UI 3.0 and side finger print activation is responsive.Adaptive brightness works good.Very nice camera and features.Big battery that can last for a day and half on normal usage.Call connectivity options.Knox security and updates.Cons:Display is HD+. Although Amoled+90Hz still FHD would have been better.Sound is good but not the best speakers.Be...READ MORE,positive
Very good phone Camera is awesomeREAD MORE,positive
Camera - 4Performance - 4Display - 4Battery - 5Value for money - 5Overall superb in this budget..READ MORE,positive
"Good  in that  price. Camera is  better  than mi mobile of same range. Compared to f41 display clarity, its little bit blurry.READ MORE",positive
Best value for money phone In this price rangeREAD MORE,positive
Very nice mobile in this costREAD MORE,positive
Very nice picture good mobileREAD MORE,positive
The best... Good choice if your budget is under 15k.. U will get 20k mobile specification in this range.. F22 is the best choice to go.. Display is awsm..READ MORE,positive
Overall goodREAD MORE,positive
SuperbREAD MORE,positive
Best smartphone in this price. Could be best if on screen fingerprint sensor was provided. Loved the camera and best thing is the battery life is amazing.READ MORE,positive
"Battery is good in this phone you will get 1 or 1.5 days Battery backup.. performance is good as per this price range, display is also good, camera is also good...Overall best phone in this price range by Samsung..READ MORE",positive
"BETTER THAN CHINESE PHONES!!( I'm MI user)PROS:good colorfull display sAmoled display  90Hz refresh rate gives smooth handling😌 🔋 Battery life is Awesome....I'm heavy user I fully  charge the battery  at morning,at end of the day it's  come to 57% (I do not play  games....but I watch YouTube  and internet surfing)Even though it's  come with 15w⚡charger.....it will charges your phone with pretty fast...I'm surprised 😮Camera is good enough for this price range.....you have options  l...READ MORE",positive
4gb-128gb. Phone is ok.I am using it from last 72 hours. But having heat problem during charging. Needless pre-installed apps. Camera is good in this price tag.READ MORE,negative
Best cameraREAD MORE,positive
I GIVE IT 4.5  POINT BECAUSE THE CHARGER WIRE IS SO SMALL & ALSO THICK. OTHERWISE PHONE IS BEST IN THIS PRICEREAD MORE,negative
"Nice product, best phone in this priceREAD MORE",positive
It's my first smartphone and I am very happy because it gives me very nice features and I think it is very helpful for my studies because I am a student.If you are a student then you must buy it.It's awesome.READ MORE,positive
Good mobile at this budgetREAD MORE,positive
"This is fantastic smartphone. I used this phone from 3 month's and felt good to bought it. Helio G80 is a good processor so, easily done my day to day task. Fornt Camera as well as selfie camera quality is quite decent And this phone last long almost 2 days on full charge.READ MORE",positive
Very good product. We love too good. Thank you flipkartREAD MORE,positive
I'm a big fan of SAMSUNG. Most of the electronics products in our home are from Samsung. It's a brand of quality and durability.It is far better than that of the Chinese brands. It has many advance features. Among them I like the always on display feature most. Thank you both Flipkart and Samsung.Its an honest review.READ MORE,positive
Best budget phoneREAD MORE,positive
Nice phone who only want samsung only.... No redmi vi vo oppo... Nice camera.... And very fast as it is using 90 Htz refresh rate.READ MORE,positive
I was a REDMI/ OPPO/ VIVO USER first Time using Samsung Phone Super Budget Phone in the range using 6GB/128 Variant .... this is awesome mobile Back Camera Side Sensor everything is fine Thank You Flipkart for Timely DeliveryREAD MORE,positive
Cost worth mobile with hi end spec.Only thing selfi cam to get improve on further update.Superb user interface with performance Sleek design and handy in sizeSound effect nice and as in standard quality.READ MORE,positive
Samsung has done the Best things in F22Blindly recommend this 👌 👏READ MORE,positive
Good qualityREAD MORE,positive
Nice phoneREAD MORE,positive
"Very nice productGood camera, awesome battery, nice design, good performance, very good display.Everything is goodThank you samsung and flipkart for this wonderful productREAD MORE",positive
"Very good phone for the price. Good display, battery , specs, performance, main camera. Average selfie camera. Fingerprint sensor is fast and sensitive but side mounted. Security updates could be more frequent.READ MORE",positive
Samsung phone Awesome💞👌😘📱📱📱Camera_ perfect👍👍READ MORE,positive
"F22 - Fantastic 22!! Yes, great phone for a less price. Good camera quality and other features too. I can recommend others to buy it.READ MORE",positive
Battery is good. Camera so awesome picture quality Every things are good.I am happy 😊 😃 😀READ MORE,positive
Good mobile Thanks for Samsung teamREAD MORE,positive
Very good Samsung galaxy f22Awesome camera battery pack up everything goodREAD MORE,positive
"Pros:1. AMOLED display which gives always on display options and color enhancement, Vibrant screen 😍2. Battery is super amazing. 2 days of backup if normal user. ( Edit after 1 year- Same battery performance)3 well optimization of software and hardware4. Knox lite version at this price range ( Edit - After the Major Android 12 update, Samsung provided Secure Folder too )5. One UI core is amazing.6. Network is good but would be better if provided carrier aggregation7. No lag 8. should...READ MORE",positive
Its ok ok deal ..you will get what you are expecting  in that price..READ MORE,negative
Camera is very badREAD MORE,negative
"Honestly, i was never a Samsung user and this time i intentionally wanted  to buy Samsung phone. After having done some research  i think, i can say i did the right thing when i purchased this mobile. Battery backup is amazing, camara night mode is just wow, display too looks elegant. So all n all, if you Looking  for economical phone then its a must buy. It indeed meets your needs. Go for itREAD MORE",positive
Battery backup 5 🌟  vary good 👍 product battery 🔋 full using me 16 hoursREAD MORE,positive
Super 👌READ MORE,positive
"Nice phone in this price rangeOf course not much more but u will get average resultsFor those who want memory  and speed will love itBut other features  like camera, display, battery,gaming etc. You cannot under estimate.A full cycle of 100% battery will give u appx.2 days battery life.Camera is avg. But give u satisfied  results.Processor also up to mark .I fully recommend  this phone to those who does not want to expend much more  .This phone will give u exact what u wantREAD MORE",positive
Good Display quality Phone.. Value for money... Camera is Awesome this Price range..Best gaming Performance..I am download Call of Duty and freefire..Fast opning game in Phone... display awesome..super amoled screen 👌👌READ MORE,positive
This phone is nice !!.READ MORE,positive
Full on blockbuster phone.READ MORE,positive
Very poor from flipkart..the delivery guy was talking using very bad languageREAD MORE,negative
"After using 2days here is my review Camera is quite decent performance is average Display is good but its not fhd+its hd+ Battery is the best in this phone, u can easily use 1day even if you are a heavy userHere is my rating-Performance-5/4Display -5/4Smoothness-5/5Camera-5/4Battery-5/5Overall it's a value for money product.I haven added some pictures clicked by this phone you can see itREAD MORE",positive
"Best in this range. Just go for it. It was so reliable and smooth display 90htz with amoled screen. Front camera is good in this price segment, back camera is also decent. Battery 6000 like monster 👹 big thumb up .READ MORE",positive
Size is small but overall performance is good especially battery backup is superb...READ MORE,positive
Very goodREAD MORE,positive
Good camera and displayREAD MORE,positive
Camera's Superb Selfe and Back camera nice👍👍👍👌👌👌👌READ MORE,positive
Super fast delivery. Avoid negative review. This mobile is best in this price segment. HD super amoled panel is nice at this price. Camera is awesome. This is third samsung mobile I have buy in my family. I really frustrated of using those Chinese mobiles. Other brands provide good hardware but worst software.READ MORE,positive
"Very Poor Sound Quality. Ringtone has very low Volume. And Flipkart not accepting Return. My Suggestion for All, Please Don't buy Mobile from Flipkart.READ MORE",negative
Giving a review after a full day's use of 6GB/128GB Denim Black variant of F22Pros...1) Good processor with speed2) Excellent 6000mah battery3) 6Gb/128Gb at 13400 net 4) 90hz separate display option5) Fingerprint sensor is smoothCons...1) Display is average2) Same body as M323) Camera is average4) No Front Camera Flash5) No headphone suppliedREAD MORE,negative
Absolutely Amazing Product..!!READ MORE,positive
Its been a year since i purchased this product. As expected it is not a gaming phone. But can be used for average gaming experience.Then comes to personel use. Its a bit heavy and thick (ofcourse its 6000mah)Have all the qualities of a budjet samsung phone. Movie experience is also great.Camera is fine for me.F22 fully fulfilled my expectations. Ui of samsung is   good as compared.Just go for it!READ MORE,negative
GoodREAD MORE,positive
I like this smartphoneREAD MORE,positive
First of all it is worth buyingThe camera is good in this range and also its better than other chinna phonesBattery was super and best back up with 6000mahDisplay was desentMost important thing is it is don't have any voice announcement option when the call records it will not give any announcement and it is coming with Samsung dialler it is not coming with Google dialler so with the best RAM and storage also it is good.6gb Ram 128 GB storageSo you can go for this mobile without a...READ MORE,positive
Nice cameraREAD MORE,positive
SweetREAD MORE,positive
GoodREAD MORE,positive
Very nice device and great value for money. Only con is its heavy due to presence of a bigger battery.READ MORE,positive
Best mobile to buy I am fully  satisfied with mobile  performanceREAD MORE,positive
Good phone in this price segment ......READ MORE,positive
"Value for money. I am using a Samsung phone for the first time. Switched from Redmi Note 8 pro to this phone because my old phone has radiation issues and I could feel the pain while using it. Till now I don't know how this phone will react, because Redmi started giving me problems after a year. Besides that I was satisfied with Redmi. Galaxy F22 is also a good choice. Pros-1. Good battery backup2. Nice display3. Interesting OS. Quite neat and quick. I was a fan of MI's OS. I found this ...READ MORE",positive
Samsung  phone Awesome 👌READ MORE,positive
sound quality is not good. very low speaker sound. battery life super. compared to m21 is best.READ MORE,negative
Software Complaint issues.READ MORE,negative
Such a wonderful product from Samsung in midrange...Pros:* Super amoled display* Hangless performance* shipped with android 11 and update available the moment you start the mobile for Android 12 and samsung promised android 13 aswell* Good quality speaker* In call reception was loud and clear* Always on display* Display is pleasant night time aswell* Even though 203 Gram weight managed well not heavier side on hands. Note : Amoled display can't cause eye irritation like normal LC...READ MORE,positive
Very good product. Battery life is too good but full charge takes one and half hrs. Camera also goodREAD MORE,positive
OkREAD MORE,positive
nice in this rangeREAD MORE,positive
You feel F22 is little heavy in weight if you are a user of realme but battery backup is superb of this phone. Other hidden features like AOD and others make it a interesting device. My only con is weight of this phone.READ MORE,positive
All okREAD MORE,positive
"Very slow, not performing as expectedREAD MORE",negative
Excellent mobile whe you upgrade after 2 or 3 years from Android phone. Overall worth for the price.  Digital well-being feature is awesome but my old phone automatically shutdown on the set time. This one feature is missing in this phone. Instead it makes the screen black and white.  After all there is an option to turn this off.  When the phone is off there is no quick option to operate mobile and hence makes the mind to goto sleep.READ MORE,positive
"Very nice phone in mid budget. Better than other brands in the same range. Samsung rocks. Strict korean standard in terms of everything Samsung manufactures like the 360 degree roof ac, the sound bar and the great uhd and qled range of tvsREAD MORE",positive
"Gyus dont waste your money, just 2 months old and now I am facing network issue.If you using JIO sim card your number will always out of network coverage area but you can see network signal is showing full strength, even you cannot make calls.And your sim will work after reboot or flight mode on off.READ MORE",negative
Samsung Phone always good. Display 10 to 10. No effect on eyes long time see movies 10 to10. battery 10 to 10 .performance 10 to 10. All feachers good 10 to 10.i like display because no effects on eyesREAD MORE,positive
Best phone at this price range.Camera is so osam.High touch display.Full hd screen.Quick response touch.Long Lasting battery backup.Get easy charge.There is type c pin which is too good.Large ram with expandable upto 1 tb of rom.According to me this is my first phone and best phone Thanks to you flipkart.Love from 🇮🇳🇮🇳🇮🇳🇮🇳🇮🇳🇮🇳🇮🇳🇮🇳🇮🇳🇮🇳🇮🇳READ MORE,positive
Better performance phone and good lookingREAD MORE,positive
Touch not good and flip cart will not take return 😡READ MORE,negative
GoodREAD MORE,positive
At these price range good mobile for usedREAD MORE,positive
Nice mobileREAD MORE,positive
Fabulous 🥳READ MORE,positive
I am writing this review after using this phone about 40 days. So far it working nice No complaints regarding camera . Battery...or anything . Budget friendly mobileREAD MORE,positive
"Been using this phone for about a week now.PROS-1. Battery charging is really fast. Battery drainage while normal use is very minimal, hence a very long battery backup.2. Display is awesome.3. Touch is very, very smooth.4. Camera clarity is very good. 5. No heating issues while charging. May sometimes heat a bit due to hot environment, but not a cause of worry. Every phone heats in similar conditions.6. Backside of it's body is matte finish, hence less probability of oily finger...READ MORE",positive
Best plus beastREAD MORE,positive
Good phone this priceREAD MORE,positive
Review after 2 months of usage..!Camera result is just ok..Front camera is better than rear camera ..U can't zoom in 48 pNokia 5.1 plus is better compare to Samsung f22Battery is awesome...Easy fast charging Performance is good..Display smooth and sensitive.No Hanging problem..READ MORE,negative
After 20 days of use my opinion.Samsung improves quality of product Camera quality is good.Battery life is fantastic.READ MORE,negative
"Best buy in this price range, lovely back up, nice performance, sexy look when in hands, comfortable in hands , display also nice could be better if full hdplus amoled still not bad it's nice in this price range, speaker also nice good sound with only one speaker, nice fast charging but slightly adapter is heating while charging anyways it's manageable..So go for it it's perfect 4g and budget handset has everythingREAD MORE",positive
"Excellent budget phone from Samsung,Smooth UI,Camera decent,supports 25w charging,Fantastic battery backup.READ MORE",positive
Very nice product. Fully satisfiedREAD MORE,positive
Super handREAD MORE,positive
Go for it..READ MORE,positive
"They should provide ear phones, and charger's data cable is too short...READ MORE",negative
Sound is not so good.READ MORE,negative
Best product in 13499 priceREAD MORE,positive
"I have used this mobile - Samsung F22 6GB 128GB variant for last 24 hours, below are my pros & cons Pros -Way better than Redmi Note 10 in terms of quality. sAmoled display Samsung is very Good with display quality.Quick response to unlock side mounted finger print button.Call reception is Good, didn't have any sorts of problem while speaking. Camera/Video is Good for this price range.Back panel doesn't leave any sorts of finger print while holding the mobile.Well balanced weight of ...READ MORE",positive
F22 is a good product. Camera quality not bad but not also very good. But over all it fulfill my needs. See the camera quality...READ MORE,positive
Very goodREAD MORE,positive
Front camera stopped workingREAD MORE,negative
Very good quality phone Super BatteryREAD MORE,positive
finger print is not workingREAD MORE,negative
Good Quality batteryREAD MORE,positive
Excellent Performance in this price range.READ MORE,positive
"Waste of Money6000 mah battery is big lie,Outdated technology,By something else, whatever ur choice,Too much regretREAD MORE",negative
Value for money...READ MORE,positive
Too much problemREAD MORE,negative
nice phoneREAD MORE,positive
GoodREAD MORE,positive
Good picture 📸 qualityREAD MORE,positive
good product comREAD MORE,positive
Good device.READ MORE,positive
Network related issue. status of network on display is ok but call not received on jio SIMREAD MORE,negative
The product is 👌READ MORE,negative
Good 👍READ MORE,positive
NiceREAD MORE,positive
SuperREAD MORE,positive
GoodREAD MORE,positive
GoodREAD MORE,positive
This phones Good and perform super...READ MORE,positive
Best phone with smooth camera and hd+amoled display is goodREAD MORE,positive
"Amazing purchase for my son!My son is in college and we were looking for 15k range phones.This one stands out definitely. Screen display, camera, sound, battery back up, look wise, sturdy and stylish. We love this phone.READ MORE",positive
Everything fineREAD MORE,positive
product  is bestREAD MORE,positive
very bad product screen is not workingREAD MORE,negative
Best Affordable Mobile in this range..my dad loves it 😍😍😍READ MORE,positive
"I recently purchased this newly launched Samsung F22 smartphone from flipkart. I was looking for a all rounder smartphone priced under 15000 rupess which is suitable for attending Online classed for my student. This Samsung Galaxy F22 smartphone is best value for money smartphone with great processor, great camera, great battery life and great display. The over all performance of this smartphone is very good. The build quality of this phone is excellent. Thanks flipkart for delivering it on t...READ MORE",positive
"Mostly hanged,heatedREAD MORE",negative
"The best smart phone in mid-range... Amazing performance , amazing photos, the battery is also large.. latest android os... and the fingerprint sensor is very fast.. unlocks in less than 1 sec... the colour is also pretty fine... overall it's worth it's price and must buy if budget is mid range... no ads like that in Chinese phones..READ MORE",positive
"Great phone, great UI, very smooth touchscreen response, no hanging issues, very far WiFi range than other Chinese phones, clear and crisp videos for online school and for great music entertainment, gaming performance too is very good than category average... 😍👌READ MORE",positive
"Good phone at this price range. I like this phone very much. Battery capacity is good enough to hold charge for two days with normal usage and doesn't face any heating problem. I like some default apps which is very good to use. Only problem I faced was sometimes screen turns on during a call, even when you hold the phone close to your face, but not often. Overall I am satisfied and i will recommend, if you are looking for a decent phone for normal long term usage.READ MORE",positive
Nice phone im this price range..Superb display🔥🥵Anti scratch backSmooth 90hz displayPerformance is averageCamera is 3.5/5READ MORE,positive
"Mobile is too slow, some times display not working, battery is good, performance is waste ,😡😡😡 totally below average mobile waste of money, don't buy,...READ MORE",negative
Battery timing good only..... Very disappointed with this phone.. Because internet browsing very poor... Not good choice for internet users... Present days all depends on internet browsing... Iam very disappointed with this prblm..READ MORE,negative
Good for common user's some where I feel that the display could have been better like the resolution disappointed and the single speaker 🔊  Not sufficient 🤨 still over All good in its price segmentThank you Flipkart And SamsREAD MORE,negative
Terrible is a word i do not want to insult for this product..Pros:What can i say NOTHINGCons:Poor batteryPoor displayPoor cameraPoor sensorI have been buying from flipkart since 2011...This was the first time flipkart add mislead me to by such a terrible product...READ MORE,negative
"Poor quality mobile in terms of display , accidentally my nephew drop the mobile from about 2 feet and the mobile display broke even though mobile had a good quality tampered glass.Mobile is awesome but very very poor in terms of display   and strength. I have one plus mi phones and even they have fallen from good height by mistake but display never broke.READ MORE",negative
Camera performance poorREAD MORE,negative
"Over good deal with buyback and credit card offer, paid rs 7800 for 6/128 GB...just back panel need to be improved, very dull color..READ MORE",negative
Touch screen doesn't workREAD MORE,negative
The camera is not goodREAD MORE,negative
"Best in this price segment, awesome camera, awesome battery, 90 hz refresh rate, and more than this it is not a Chinese product.READ MORE",positive
"When I placed the order, it got delayed and cancelled due to damaged by logistics issues, later I placed another new order, received the phone on delay....the touch is not smooth, phone is raising abnormal noises suddenly, no network issues....this is the 1st time I had faced this issue over Flipkart....i use to always appreciate online shopping and Flipkart but this time I suffered a lot.READ MORE",negative
Very nice 🙂🙂🙂🙂🙂READ MORE,positive
I'm rating this phone after 1 month use Bettery 5*Display 5*camera 5*Display 4*performance 4* i get it few heating but verry few its better then realme redmi and all chines phoneREAD MORE,negative
Poor camera.48 mp better than old rear 13 mp camera.READ MORE,negative
Touch not workingREAD MORE,negative
Never bye it and quality is very bad trying to return but flipkart is not returning this....dont waste your moneyREAD MORE,negative
Good cameraREAD MORE,positive
Best phone in the price range by samsung.READ MORE,positive
Cam is ok. Lovely performance of battery.READ MORE,negative
Samsung Galaxy F22 😋  Phone is  Awesome Back 👌 Camera  Awesome But  Front Camera Better  OK Battery 6000 OK 1 Day  Used OK 👍 Thank U 😊READ MORE,negative
Not good mobileREAD MORE,negative
Good quality and good performance camera fantasticREAD MORE,positive
Jio sim incoming call not supported...waste of moneyREAD MORE,negative
Very worst mobile  my order 2 mobile  very poor hanging  mobile camer very poor ....return filpkart very poorREAD MORE,negative
Defective product! Speaker not working properly.READ MORE,negative
"This Phone is very nice battery ,camera Display was awesome 👌READ MORE",positive
"Awesome budget phone from Samsung after a long time. Camera, Battery , Amoled Screen , Looks & Performance all good. 👌👌READ MORE",positive
Very nice CamaraREAD MORE,positive
"Bought this mobile after using my previous mobile for more than 3yrs.   My primary use is for calls, msg, web browsing, social media and occasional games. I needed net connection all day. With this phone, I could get all my needs fulfilled. I use jio and bsnl. Both offer fast and uninterrupted connectivity. Browsing, download and upload speeds excellent. Call quality and loudness great. Speaker volume and clarity good. Connects seamlessly to my Bluetooth headset. Boot up and using apps are a ...READ MORE",positive
Speaker not good flipkart delivery was very faster.READ MORE,negative
"camera very very very worst.poco mobile camara is the best.in samsung mobile no compass app.flipkart not good ...please friends don""t order in flipkart .flipkart supply problem items.READ MORE",negative
badREAD MORE,negative
