review,sentiment_label
"Please do not buy Apple product or any phone from flipkart anymore. after spending so much , it results in disappointment. I got 5S and it was heating up like crazy. I got very good response from flipkart and they exchanged my phone asap. after getting a new exchanged phone, it looks like it has been used before. Apple is not new to me. this is surely not a new phone.READ MORE",negative
"Apple lovers will love this phone without any doubt. Apple is always consistently proving that they are No. 1. Out of all models, 5S is very successful and good looking as well. Appreciate the delivery of Flipkart on time. Very much impressed with you guys. Keep it up.READ MORE",positive
THIS PHONE IS THE BEST. THE TOUCH VIBRATION AND GRAPHICS ARE SO GOOD THAT YOU WOULD LOVE TO USE IT.CAMERA PLACES AN ADDED ADVANTAGE .THE PICS ARE SO CLEAR THAT THE PIXELS CAN BE COMPARED TO 20 MP CAMERAS .FRONT CAMERA IS OF 1.2 MP  BUT THE PICS ARE EXTRAORDINARYREAD MORE,positive
"First of all, great service by Flipkart. And secondly, iPhone 5S can make anyone awestruck . Everyone should go for it, but try buying the 32gb because now a days 16gb isn't enough for us anymore. Thank you once again Flipkart for getting me a good phone for a reasonable price ! :)READ MORE",positive
"I am an Apple fan because of it's best hardware and software compatibility. Though specifications are not eye catching but those things are just meant to fool the customers .It has an 8MP camera better than 16 or 20MP of any other android phone. It has got just 1gb ram and a dual core processor but u cannot find a small lag in any of the high end games like Asphalt 8 , real racing , injustice etc..Even its front facetime hd camera (1.2 MP) is much 2 better than the 8 MP rear camera of many...READ MORE",positive
"Am very impressed with this phone. It has every feature that is required in modern times. It has an awesome camera.It is very handy unlike the iphone6. I recommend this to anyone looking for a smartphone less than Rs. 40,000 as it is the best in that price range. Flipkart was superb in delivering the product on time.READ MORE",positive
"I have ordered it form Flipkart and got the same delivered next day to my office address. Apple product as usual are value for money, though I had issues initially as I switched my unflinching loyalty to Apple from Nokia. As of now I am happy with the product, it is user friendly, simple and maintains its exclusivity. Application store contains all the important application that I wish and desire for and unlike android all application work seamless and flawless on the iOS. Camera quality i...READ MORE",positive
"Hey guysI am  reviewing this product after using it from last 2 week. Trust me after using iPhone   you will feel the change. Touch is super fine, camera is excellent or else what to say its the bitten APPLE thats quit enough.READ MORE",negative
"Awesome product. Reviewing this product after 6 month of use, No flaws. Super performance, good battery. Mainly great camera. but costly.READ MORE",positive
"Flipkart service was fantastic, on-time delivery in a quality packing. I was quite excited to get the intact and beautiful iPhone 5S Gold. I made sure that the piece that I got was genuine with the Apple customer care. I have used the phone for two weeks now. My advise to new iPhone users - if you have doubts in operating it (especially changing the micro sim to nano sim) better go to a reliable store. I had an issue in booting up when I first started the phone. I was advised to reset my ph...READ MORE",positive
"I won't keep this long. If you are a person who is busy, heavy-working, and a person who relies on electronic forms of doing things, then this is the phone specially made for you. This phone is ultimately fast, responsive and has it's own style. Two High Definition cameras(8 MP primary and 1.3 MP secondary), A7 processor with an 64-bit architecture, with an additional processor specially designed for rendering pixels on the screen, millions of applications specially programmed for you, availa...READ MORE",negative
"I recently got my Apple iphone 5s and i must say, its just a class apart! Previously, I had been using Nokia Lumia 800, with windows OS (of course) and promotion to ios feels really good. Talking of the features the phone offers, am completely satisfied. A special applaud to the Flipkart team for such an efficient and surprisingly fast delivery! KEEP IT UP!READ MORE",positive
"Got this at a great price from Flipkart and immediately ordered it , what can i say that hasn't already been said about the 5s ,its the best iPhone ever. Very Satisfied & i know there is a lot of debate especially from the Apple Resellers that Flipkart apple products don't have an official warranty,that isn't true. My device is officially imported by Apple India and has the official Apple indian warranty. Good job Apple & Flipkart !READ MORE",positive
I got iPhone 5s 16GB two days of placing order.. and its provided by WS Retailer... Dabba pacaking ...packing was not at all good..but luckily phone was in good condition and after opening package i have checked phone and it was totally fine and good :) there is no match to Apple iPhone..its one of the best phone in the world. Super fast :) Super Camera and super operating.... WS Retail guys u please try to pack costly and electronic items in good way..Here I am Fiver Stars to my iPhone 5...READ MORE,positive
"I have been using it for almost 6 months now. I love the IOS its really very cool & fun after using Android for a long time. 5S feels too rich & very comfortable in hand, design is awesome, the display is honestly best I’ve seen in a phone before. Fully satisfied with this Product. Thanks to flipkart for given this in Best price. :)READ MORE",positive
