review,sentiment_label
Thanks to Flipkart and WS Retail.I replaced my 2 year old nexus 5 (32GB) phone with this iphone5S in replacement offer from flipkart. So I received this iPhone from WS Retail in Original Apple iPhone Packaging.All accessories are Brand new including iPhone Device. I crossed checked warranty of this product by entering the serial number of device and confirmed online that phone is having 1 year validity. I called to Apple iPhone customer executive and given the serial and IMEI number of devic...READ MORE,positive
"Guy z  by the above comments it looks like so many people don't want to buy the iPhone.Below could be the reason ""Because they could be thinking the cost is high""1)If you look at the specifications it is 64GB and 8Mp ,No phone is manufacturing with 64GB internal memory2)We cannot compare touch feel with any other mobile for sure.3)Even though there are so many phone's providing 18 mp camera but if we compare 18MP camera mobile's  with iPhone more or less looks like same quality4)No...READ MORE",negative
"For me mobile phone is a kind of an investment, which I have to use for next 4-5 years. I upgraded from Nokia C7 to Apple iPhone 5s. For this decision I contemplated over 3 months since the price was huge, but after using it for last one week, I am more than convinced & satisfied that I have got a very good & unique product. UI - Very beautiful & User friendlySpeed - Butter SmoothDesign - Awesome & ElegantTouch Sensitivity & Usage - BrilliantOS - SmartI think iPhone is an experience &...READ MORE",positive
"No one can beat apple The iPhone 5S: a phone that looks like the iPhone 5, but goes so much further under the hood. Is that going to be enough to impress the baying hordes?We've been here before: the iPhone 'S' conundrum. The new phone comes along, taking the shell of the previous model, adds some new bits and pieces, and then claims to be an entirely new phone.Scores in depthDesignFeaturesPerformanceUsabilityValueWhich it is, of course. But also it isn't. Well, mostly is. To be su...READ MORE",positive
"I was really looking forward to own an iPhone for last 2-3 years & Flipkart helped me to make that dream to a reality in the form of an iPhone 5S Spac-e Grey 16 GB  (Model A-1530). This is really a stunning piece of creation & I was amazed by the kind of discounts offered by Flipkart & WS Retail for such a flagship product from Apple. The product was safely delivered as ""manufacturer box packed iPhone"" double packed inside Flipkart's own box along with Credit Card swiping facility while t...READ MORE",positive
This is my second iPhone and it is the best option to enjoy iOS in your budget. I owned it for just ~₹11500 from flipkart after availing exchange offer and 10% instant discount on SBI debit card. Thanks Flipkart to make this phone avalable at this cost. The iPhone 5S is awesome in design and performance and It is still being supported by Apple. You can install iOS 11 too on this little master.READ MORE,positive
Happy With Flipakart .. got the orginal prodcut and working very fine .. Thank you so much flipkartI wants to buy another phone can you give a good price for meREAD MORE,positive
Hey it about a year i am using this I have bought this phone from flipkart.still it works like a charm unlike andriod phone which have a life of year.Thanks flipkart!!!READ MORE,positive
Awesome deal.. There's nothing like an IPhone.. Worth 5* .. But giving 4.. because of the storage.. I suggest to go for minimum 32 GB..READ MORE,positive
"Best phone from Apple.bought the phone for 13k in flipkart big billion days. While i could see the same phone in amazon, snapdeal for 20k to 21k. Have been using it for 1 month and here is my full review.Pros:1. Never hangs. 2. High level games can be played flawlessly3. Both cameras are perfect and it allows you to take a professional photos.4. Fast charging.Within 50 mins, it gets charged from 5% to 75%.5. Fingerprint Scan works perfectlyCons;1. Battery capacity is low. But if...READ MORE",positive
"this is my second phone, It is awesome phone.  Size of the phone is perfect.  Fits into the shirt pocket, friendly for the hand to hold. screen clarity is excellent. It is 40% of price to 6s, but has more than 90% of its features,READ MORE",positive
Its ma second iphone. its really good and original product. i love it. its really fast delivery by flipkart.READ MORE,positive
"I was very pleased with the speed of delivery and flexibility in receiving the item. Well I can't speak on the quality of the product as it was a gift for someone else but overall a very positive shopping experience. At first I was skeptical about buying the iphone online, but seeing the F-Assured badge gave me a lot of confidence and comfort in buying the item.READ MORE",positive
Apple is apple.....there is no comparison with this piece of art. W S Retail is the trusted and worthy for its service got the product earlier than promised. Well packed and secured... Thank you flipkart for providing such products through these genuine retailers....READ MORE,positive
"About handset:  Beautiful phone. Works flawless with 9.3.5 iOS. Compact and fits perfectly in your palm, its a one handed device. About Flipkart: I got product in two and a half day from bengaluru to Ankleshwar. Awesome!!!!READ MORE",positive
Great delivery by flipkart with nice packaging arrived very fast..... the iPhone 5s is 100% original ND authentic one can close there eye and by from ws retail .... I am just loving it.... thnxxx flipkart...READ MORE,positive
"Awesome phone.  Nice packaging by flipkart.  I got the white one as the black one isn't available at the moment. White one is good.  Got huge buyback value of my 2 years old phone. (Purchase value of old phone +500 to be exact).  Really... I'm shocked to see that. Phone is brand new.  Manufactured in June 2016. MRP-25000.  Imported by Apple India. Genuine Product.  For now, everything is working flawlessly.  Very happy to get my first IPhone. Thanks to flipkart for their quick delivery. Got i...READ MORE",positive
"Will not deny that this is a great equipment ! But definitely outdated not just by specs also due to unparalleled modernization and user friendliness Android OS and devices has evolved to.Iphone 5s though handy and light weight just cannot compete with a modern Lenovo A6000 plus wrt to Value for money ,sheer usability ,performance of both software and hardware .Example : Lenovo easily picks 2 bar wifi signal from my N 900 router ,iPhone just refuses to indulge .My Plantronics edge gives amaz...READ MORE",negative
"I searched a lot before buying the phone at other websites, It was available at FK at best price. The delivery was really quick without paying for priority shipping.The packing was good, and box was intact.The phone has been working fine sicne purchase, no lag, no hanging problem, nothing.So if you want to buy this, you can buy from FK with out any doubt of duplicate phone or delivery or any such problem.Perfect gift for wife!!! :)READ MORE",positive
the phone is really awesome as u know the brand is apple so what else... thanks flipkart for it's delivery on time. ya the phone sometimes do gets very much heated because of excess use like other iphone users also face it. so it's not at all a fault of flipkart.. otherwise am happy with packing and it's delivery on time. and everything is genuine. it's a worth one.READ MORE,positive
As expected genuine product from flipkart. The phone made was also June 2016 and bought in July 2016. Good one and 1 day guarantee delivery added charm.READ MORE,positive
"I'm giving this review after 1.5 months using and here I could say that this phone for those who want something new and innovative in terms of security,quality,features and looks and not for those who are android addicted and want to use this phone mainly for third party uses. It's my first ios and even after one and half months it feels new and classy as well. This review for those also who blames flipkart that they provide duplicate product i would like to say that it is totally wrong. Pr...READ MORE",negative
"1. Have you used this product?It's always better to review a product you have used.2. Educate other usersProvide a relevant, unbiased overview of the product. Readers are interested in the pros and cons of the product.3. Be yourself. Be informative.Let your personality shine through. But its equally important to provide facts to backup your opinions.READ MORE",positive
"Switched from Android to iOS.Pros: -Privacy is actually taken care of by Apple.-Security is good for iOS.-User interface is bit tricky if you have used Android, but after using this, it gets going good.-Performance is optimized, had good gaming experience. Never slow since last 6 months of usage.Looks rich and gives that something ""different feel"".-Appealing feature of iOS is that it will keep the process in cache and alive for sometime, after 3 mins or so it will remove the cached...READ MORE",positive
"I was quite dubious about buying iPhone 5s in May 2016 since it was released way back in September 2013. But I went ahead with my decision of buying this phone.And I have to say, I'm in love with it. Pros:Comes pre-installed with the latest iOS 9.3 Excellent Camera Quality - both front and rearAlmost-lag-free experienceAmazing feel because of the excellent build qualityCons:Gets a little heated up. Use a good back-cover and you'll hardly feel it ;)Battery runs out very quickly ...READ MORE",positive
It has a larger sensor and aperture tat it captures stunning pictures And the dual coloured led flash makes Photos look even More dramatic.This phone is the BEST phone ever and is made for a premium group of customers who love their phone and respect the legacy of APPLE!!! Good Camera...Fantastic Display...Superb touch...Amazingly Fast...Touch ID gr8...And at a very low price also...thanks to FlipkartREAD MORE,positive
"I got this phone from WS Retail on flipkart for a price of 18.5k. When I check the price today, it is 22k. I ask myself whether I would buy the product today for 22k and the answer is yes.I bought this phone as an upgrade to my Moto G first edition. Now that I am using an Apple product and iOS, I doubt whether I will ever go back to android. The UI is absolutely amazing and I have nothing but praise for the performance of this device.A lot of people had discouraged me from going for this ...READ MORE",positive
"overall;- very good worth a purchaseevery thing is good but it heats up while playing gamesDelivery by ws retail is very fast, its been delivered by 3 days even though i am in Guwahati. Packaging was Good and it was seal packed.Warranty period was being covered by the Apple, Checked in the Apple Warranty Site.All inbox accesories are being provided and are in a good condition.READ MORE",positive
"While i have been using this piece for over 2 weeks, I am more than satisfies with its performance. I believe I have just got it at the right price of 18500/- and awesome delivery experience in 24 hours from the time of order. It was COD so I anticipated to have a look and feel of the product before I would pay. I had to pay before I could touch or feel my product. However, the deliver guy was patient enough to wait till the time I opened the Packet, opened the Box and and saw the piece in ...READ MORE",positive
"I had been jumping between Asus Zenfone to Nexus 5 to Iphone 5c and finally this 5s since Aug 2015. Once I was on iOS it is very difficult to even consider another OS such is the way they make their products. The iPhone 5s is perhaps the best design Apple has ever made. With its metal body, camphered edges and small size and light weight. The phone looks awesome when you hold especially the Space gray with its understated looks. I just upgraded to iOS 9.3 and seems like battery life has imp...READ MORE",positive
I'm using iphone 5s since  9 march. Flipkart delivered it next day after order . its is worth to buy in such a great price .at-least in this price segment no phone will going to offer these features .1.such a nice design.2.IOS 9 was already updated.3.Touch very smooth .4.iphone didn't lags in running multiple apps at a time.    which actually makes iphone a great phone to buy. 5. last but not the least touch id ..READ MORE,positive
"Well nothing much about iphobe, but really got to admire Flipkart for the promise and delivery timelines! Kudos to ekart heroes!READ MORE",positive
"Delivered in two days,  packing was perfect, used for 4 months, awesome phone coz its apple so no doubt, now it's time for iphone 6 I'm excited for my iphone 6...I'm in love with apple just go for itREAD MORE",positive
"pros: stylish phone in iphone seriesbutter smooth performance. i like the touch ID option very easy to unlockcons: ear piece audio quality is worst,physical buttons are also not good compare to my iphone 4s.while conversing during call volume comes from earpiece as well as from external speaker generally this will not happen in premium phones.READ MORE",positive
This really an amazing phone on this price I am using this phone before 1 month and it's working awesome really I love it Thanks FlipkartREAD MORE,positive
Best buy ever. The flagship version of iPhones comes in a handy look which is user friendly to access and utilise all the screen single handedly.READ MORE,positive
Great phone now I understood why apple iPhone's cost too high great quality product excellent fantastic fabulous marvels...... no words to say thank flipkart I got with in three daysREAD MORE,positive
There is nothing much to tell about iphone yet would like to add a few points this phone got a new look the home button ...flipkart as usual awesome n sold genuine product and due to independence sale got at a good priceREAD MORE,positive
Very good offer and Flipkart customer support and delivery are very nice and iPhone 5s is a amazing phone.READ MORE,positive
"Very good support, i told your delivery super man pls deliver the phone within 12 AM,so your super man delivers the phone sharp 12 AM,same i gifts to my friend so thanks for your support & thanks for your super man also....good support.READ MORE",negative
"The product I purchased from flipkart iPhone 5s is original and also have full 1 year warranty. I checked also the product is brand new. iPhone also good to use, stylish also. Recently apple give an update of ios 10 which is a bonus to me. But still I do not give iPhone 5s more than 3 star for a reason. iPhone was my dream phone and I buy it to touch the dream. Bt my dream shattered only within 10days.  It slipped from my pocket when I bend to take something from the floor. It just fallen onl...READ MORE",negative
"I will not go with its specifications but I will describe phone in one line. ""This phone is for those who believes in perfection. From every angle you will feel how much perfection this device is"". I know people will compare its technical specification with other brands and will come to conclusion that this is out dated with current market race.  For such peoples I want to say can you compare, Dhoni with Sachin. No you can't because are perfect in their class. Don't judge phone with its speci...READ MORE",negative
"Its a good phone to buy. Quality wise is nice, good camera, sound quality, looks and speakers. The new iPhone 5S is much more better in all aspects from its predecessor.READ MORE",positive
"I am having IPhone 5S from more then 1 year and i am not facing any problem with this, i recommend this product to all as i found 5S a best and awesome product Apple at its best as compared to 6 and 6S.READ MORE",positive
I bought this product from Flipkart on 11th August  2016 and Flipkart delivered this product three days before. Awesome experience. Battery backup is good not that much. If you are a power user like me then the battery would last max upto 10 hrs - 14hrs. Performance wise this phone is awesome. Works seamlessly. I would really love to advice you people to buy this phone. Worth buying.READ MORE,positive
"1. Fast next day delivery with Ws Retail.2. New unused phone.3. Its not refurbished phone. Its original made in Aug 2016.4. Bought at 20,999/-.5. Battery works for 5 hours with 4g and 10 hour without internet and gaming.6. Very compact size.7. Thousands of apps available free of cost.READ MORE",positive
iPhone 5s in 2016. Is worth buy it's run iOS 10 very smoothly. Feel the apple experience in this price. Awesome experience on time delivery.  Easy exchange good value of old phone as well. And original product cross checked with Apple serial number valid purchase iPhone under warranty.READ MORE,positive
"Flipkart shipping was quick and delivered the product within 2 days inspite I being aIn other corner of the state hence he deserves ***** star.WS retail should be crowned by 5 star for awesome packing and with all accurate bills and warranty cards.However when it comes to Apple 5s overall experience is Ok but not worth for the cost are levising, Touch and feel is awesome, Earphones and other accessories are cool.I give 3 star to the phone because audio files wont get stored in the gall...READ MORE",negative
VERY VERY GOOD service by flipkart. one of d most valuable product with low  price than others. its working good n have a awesome look.READ MORE,positive
I am fully  satisfied with filpkart services in time delivery and a great  product with great offering no doubt  about guys blindly go for it never think  about negative review's OK guy's  all the best and I am so happy with this product .....READ MORE,positive
"Overall good experience... delivered in 3 days.Phone is awesome no doubt after all it is apple device...But slightly heating up when browsing 3g/4g, during charging and during calling.Camera is average , good in outdoor conditions. Video recording is up to mark. Finger print sensor is sensitive and accurate.Front camera works well in outdoor lighting conditions.16gb phone have around 10 GB space available for use..and iPhone apps are bulky n heavy in size so be careful if you need more a...READ MORE",positive
"Got the 5s in a good offer that is with an exchange and also a cash back, happy with the delivery but encountered some problem after two days of usage that is phone goes to silent automatically but once restarted works fine. Hope it is a software issue which gets rectified in the next update. But overall experience is great as it is my first Apple phone and feels very premium and comfortable than what I expected.READ MORE",positive
I recieved iphone 5S mobile on 13th Aug and the mobile is Genuine Products check with apple registration & its truly Awesome.Ws Retail is Trusted Retail. Very fast Delivery From Flipkart than Expected.READ MORE,positive
"I purchased this a week back. Working delightfully till now. Its original no doubt. In this price you can buy a shitty android phone with a much larger screen. But Apple's class can never be compensated.Pros:Awesome display Great cameraSmooth UIAwesome EarPodsCons:Charger heats up a bit while changing. But checked with the Apple service centre and they said it's completely normal.To summarise, its a wonderful phone if you are tired of seeing your android phone getting hanged and s...READ MORE",positive
"I was always an Android user and never thought will ever move to I phone. Bought this phone (5s)because it was available at a great discount on EMI of course it was an independence sale. This a genuine review for all those who are an hard core android user and who always thinks 'Is buying an I phone worth?' All I can say buying an I phone is more than worth, An I phone is an I phone and you will never ever regret. Let me tell u once thing the technology  apple uses is far more advance than it...READ MORE",positive
"Awesome Product from Awesome Seller like ""FLIPKART"" the Make in India company on which u can trust..Package was so well done no question or dilemma of safety of product ... Thanks FlipkartREAD MORE",positive
"First of all I want to say thanks to Flipkart for this amazing iPhone 5s in time delivery. Secondly , after reading all the reviews from other customers I thought that buying from flip kart may become bad experience to me, but kudos to Flipkart, that made my decision really great for buying this from FP. As I got iPhone 5s in exchange of one of my heartiest phone Lumia 920, which I had bought 3 years back from Flipkart as well and that phone till now working very good , but due to windows pla...READ MORE",positive
"I am using this device as a regular usage day to day,here is my genuine review:Pros: 1. Awesome camera 2. No lag and smooth OS3. Good to hold and easy one hand usage4. Call quality is good5. Finger print reading is outclass6. Good Music output and apple custom ear phonesCons: 1. No memory card support for apple devices2. Camera is artificial lighting struggles sometimes3. Very small in size and difficult to browse and view in desktop mode4. Can't transfer files , media etc via Blue...READ MORE",negative
FINE PRODUCT WITHOUT ANY DEFECTS. I LOVE MY IPHONE 5S. SUPERB JOB BY FLIPKART THEY DELIVER MY PRODUCT THE VERY NEXT DAY. NO DEFECTS ON MY IPHONE. ITS VERY FASTREAD MORE,positive
I bought the iphone from the WS retail. Its Brand new and original with sealed pack. Thanks flipkart. Its a awesome phone. Loved the camera. Grip of the iphone is great. No other words. Iphone is Iphone. Don't get hesitated to by from WS Retail. They are my trusted seller from past 3 years.. I dindn't find any problem with them till now.READ MORE,positive
"Thank you Flipkart for delivering it before time to a place not serviced by the A-to-Z of the worlds. Great product, Exciting Price, Superb Delivery.READ MORE",positive
such a amazing deal m ve ve happy my new i phone 5s thnx to flipkart dis amazing deal and thnx to WS retailREAD MORE,positive
"Best price genuine product & good service, thank you to flipkart teamREAD MORE",positive
"i received the product in good condition. WS retailers did wonderful packing and delivery was so fast Ekart, attract the customer of Flipkart no doubt, totally i'm so happy i love 2 buy again and again only in flipkart. I can't say anything negative about IPHONE, bcoz it is really wonderful pieceREAD MORE",positive
A phone with an elegant design and a masterpiece after all requires no description. But battery life is not as up to the mark. If you have a heavy usage of the phone then u have to charge the phone more than 3 times a day. Overall the phone is awesome. Because of the battery I rate this phone 4 stars.READ MORE,negative
"It been couple of months since I have IPhone 5s. Initially, I was thinking to go for some cheaper brand such as LeTV, which has all the features. But, I am really happy that I decided to buy IPhone. I am having very good experience so far and have no heating problems as mentioned on other reviews. So, if you are planning to buy IPhone for first time and have some confusion, I would say go for it. It's worth buying.Hope it helps.READ MORE",positive
what to say pretty happy ....3thrd  iphone bought and 11th  phone over the years from flipkat .....and never have been disappointed........ in the past 5 years never have bought a phone a store or any other site.......and for the iphone 5s ...itz working fine and is a genuine product.....READ MORE,positive
Its very compact and awesome phone to use. I recommend to use who ever doesn't like big phones. I suggest to you this. Thanks for the flipkart for the wonderful ontime delivery.READ MORE,positive
When i placed order i was pretty Confused about the seller. But Still i placed the order because it was the Lowest Price 21279INR on Any Website for IPhone 5S Space Grey. Ordered it in a evening at 4.30pm got it delivered by Next Day 2.00pm Less Than 24Hrs. This is what in a day means to me. Extremely Fast Shipping As the seller is a Flip-kart Advantage enlisted seller so the product was so well packed and intact.So Far So Good.READ MORE,positive
"Great to use an exceptional mobile. Now its in my range to afford it. Great experience to have a portable device with extra ordinary apps and features. 1GB ram is fast like 3GB ram in other brands. Its small, smart and best phone.READ MORE",positive
"Thanks to Flipkart,, very good delivery in time with Good Packing Condition.. it is a very good Phone as we know already.. flipkart is giving the in such a good way and with sealed genuine package.. thanks to flipkart once again.READ MORE",positive
"Good product, The silver color looks good compare to other colors8mp camera quality is pretty much good compare to other android devicesWorth buy, But battery is the minus pointREAD MORE",positive
its a good product i was brought all most i month complected i was great moble and good product by flipkart also .READ MORE,positive
"Using from last 4 months, no comparison to Apple, compact size and user friendly. Battery is only negative in Apple 5s. Completely satisfied. Have used Android all my life, Samsung mainly and few Chinese products but after buying an Apple Iphone i wondered why i didnt shift much earlier. Even with just 1 GB RAM it is faster and more efficient than most 2 GB android phones.READ MORE",positive
i am using iphone5s it is a great phone best camera quality great speed of the mobile it is the perfect phone in this budgetREAD MORE,positive
Apple is and always was the best and outperforming ios phone in the market.It doesn't only shows your status but gives you the best user platform.For best prices and offers click the below link.http://fkrt.it/C8y3dNNNNNREAD MORE,positive
