review,sentiment_label
Awesome powerful RAM in 1gb variant an other phone....!!!!!!    ..so power fullREAD MORE,positive
"As always.. iPhone is iPhone..Using about 1year and more..It is 4g- only internet can be used, no volte ( cannot able to call)Moderate battery lifeGood camera quality both front and rearNothing to tell something new.. it's a iPhone so u obviously have very limited apps, no storage capacity only 8gb will be available in 16gb model but that 8gb also will get disappeared no one knows how and why.. once it got broken Ur mobile u have to sell some of Ur property and u can resolve it with A...READ MORE",negative
"Using since 15 days, after a heavy usage heating problem has solved.During charging it heats up ⬆ between 39-42Its manufacturing date is April 2016Thats y its running ? at its best.READ MORE",negative
Apple Rocks!!! And iPhone 5s has proven this fact once again!!!!Amazingly Fast...Touch ID gr8...Fantastic Display...Superb touch...Good Camera...The Gold looks gr8...Just download gr8 apps and keep rocking...Add some Midas touch to ur lives... Get one 2day... Thanks...READ MORE,positive
Well the iPhone 5S is here ! its the best iPhone today ! but is it up to the mark ? Well Yes ! Short Review :-Build quality !The iPhone 5S comes with the same look and feel as the last years iPhone . The screen is the same Although there is a fingerprint scanner in the front now ! also knows as touch ID !Camera:- The camera has been bumped Amazingly ! Although 8mp like the last year ! the iPhone 5s now has a larger sensor and aperture tat it captures stunning pictures ! And the dual co...READ MORE,positive
The product turned out to have EXTREMELY/ABYSMALLY low battery life. I have to charge the same at leat three times a day and have to constantly carry a power pack with me.READ MORE,negative
Excellent product:)Product packing is superb & it has been delivered before estimated date.I-phone is authenticated which is crossed checked with IPhone web service support.READ MORE,positive
I am first time user on iOS. Using this phone from past 3 weeks and happy with the product.No heating issuesPerformance is very goodBatter backup is excellent for normal usageSo far very much satisfied. I would have given 5 star rating but would like to wait for further usage of the product and its features.READ MORE,positive
the phone  was totally awesome.... thanks for the wonderful deal... got it at 12K after all the exchange and cashback.  even got gift card because the seller decreased the price it was a awesome experience. ..received the phone in 1 day with brand  u...i suggest this seller....READ MORE,positive
"Hi Guys,Using Flipkar Since 6 Year but never ordered anything for more than 1000 as had a mentality that we should not buy online bla blaNow First of All.EKart Courier - Awesome Speed - Ordered on a Friday Afternoon Received on Monday Morning with Excellent PackagingPhoneWill not comment on its working as its just 12 hrs am using it. But the piece nothing can get better than this one. Its smooth fast cool awesome sound clarity i think i will be out of words.Will surely comment on the...READ MORE",positive
"Whether you're tech-savvy or not, you'll need to learn how to use this once and you're set. It's that easy to get used to!The best phone money can buy!Superb camera, great music clarity, great multitasking, sharp screen, good battery life, the best and most secure App and iTunes store in thew world.If you're willing to use this phone the way its meant to be, you won't ever need another brand!READ MORE",positive
Weak battery performanceREAD MORE,negative
"fellas ,u might have always thought of getting to a better place for ur stuffz . Let me tell u this is probably the best u can get as far as the eyes can see and the mind can think.Being a prospective buyer, i did think 10 times before ordering my iPhone through online channeling , as it often strikes you that if the prices are less, then there is really something cooking . But no , the prices are good , the order is well delivered , sometime so early that i was not even prepared to pay as ...READ MORE",negative
iPhone 5s!!!!!!!!!!!!!!!!!Awesome battery backup Awesome camera front and back Awesome speedNd last 1 is every 1 say dnt buy mobiles phone online because it was fakeNow i am telling u their was no fake !!!! must  buy because Flipkart is trusted online shopping site !!!!!READ MORE,positive
"Rs.20499 with 10% cash back, super awesome deal!!! landed cost around 18750 cannot be matched by anyone. phone looks good. checked for product registration and full 365 days warranty available unlike few who  have complained that they received used product. Manufacturing date is also of November 15. But was not update to latest version of IOS.  Got it upgraded to IOS 9.2 immediately on startup. Delivered well before time. packing was OK,I would say. I think flipkart was relying more on the ...READ MORE",positive
This is the best phone available in the market and can't be compared with samsung or other android operating devices. People here giving bad reviews are those who never used an iphone or can't afford it.Specification wise it has a dual core processor and still beats samsung's 8 cores or 12 cores. Just pay once to apple and it will treat you like a king ;)READ MORE,positive
Phone not worth if ur buying in 2016. The iOS10 makes the phone super slow and it's not worth paying 20K. The phone is overpriced whereas you get good options at this price tag. The 16GB is a failure model and you get nothing from it. I have bought this phone for my dad who just uses for calling purpose....that's it...because it has a good voice clarity and feels rich in hand.READ MORE,negative
the charger is getting heat up and phone is also heating up....if i use 3g or wifi with video or facebook then also its heating up...READ MORE,negative
Nice Phone in nice range @ 16050/-Got in time.Was properly packed.Got it at only Rs. 16050/- in a deal.Handy as it is of 4 inch screen.NO LAG as expected from iPhone.Awesome touch response.Display is really nice.CAMERA quality is so nice though the rear camera is 8MP. Image originality is just perfect. The image quality is as u see in bare eyes and no 8MP camera of any android can provide that.Good optical image stabilization.Nice slow motion camera.Specially the FRONT CAMERA is...READ MORE,positive
after using 4 years fone sucks exchange value 1200purchase cost 41000READ MORE,negative
Bought my 5s 4 months back from flipkart.its running fine.handset n accessories were well packed.flipkart didn't disappoint me.READ MORE,positive
An American dream phone and with good phone features and performance.I am very happy with the product and this is my first memorable gift from my sister.please buy this product guys out there!!!???jai hind jai telanganaREAD MORE,positive
"Ist iphone. better than any android platform. Camera quality is ok. Performance is superb even on just 1 gb ram, it like more than 4 gb ram in android phone. Best thing is security. I use several banking apps wing closing my eyes.But there is two biggest fault. First one is battery within one and half years battery was totally damaged.and second one is it is not volte supported that means you can not call with jio sim.READ MORE",negative
"Glad to write after almost 5.5 years, phone is working fine and go longer than this. I'll be using this till last.READ MORE",positive
"stop complaining this product , im usig iphone 5s for 3 years and im not getting any problem and also stop saying its not pairing to another devices ,have to pay for each app in app store ,storage problem..etc...  you know all about this then why the fk you want to buy an iphone and making bad impression on it , its made for rich people and people whom need high security not for dump people .READ MORE",negative
"Hi Folks!!!I cant afford iphone 6 so I pick 5s if you can just wait and go for iphone 6...Flipkart services are awesome no words...Coming to phone...I have come acrossed  android (nexus 4), Windows(Lumia 920), now ios(iphone 5s).As from my experience I would like to share some of my points:NOTE: I'M NOT TRY TO SAY WHICH ONE IS BEST !!!!ABOUT PHONE:Cons:         * Screen size                   --- internet surfing, photo, video         * Battery Backup                   ---...READ MORE",positive
"pros:operating systemcons:heating problemless ramless internal spacenot a full hd display low resolution camera ,picture quality far below from a digital camerascreen size is also lessREAD MORE",negative
"iPhone 6 64GB is proced lower than iPhone 5S 64 GB. Flipkart, are you stupid to ignore this type of discrepency in the price.READ MORE",negative
Nice phone in a decent screen size good for girls and women 😉READ MORE,positive
"Iphone 5s a beautiful piece of machinery yet small in size but works like a beast in real world . Loving using these device daily . I think it is worth it to buy IPhone 5s still in 2017 because its performance is just awesome . Camera is just outstanding of these little Boy . And it sounds awesome for any song u want to play . The Bass , The Trebble is just perfect and perfect are the EarPods too . So guys if u r thinking that should u buy these device or not I would suggest u just go for it .READ MORE",positive
Most folk in India need an iPhone to flaunt. Without that you just haven't arrived. It is for this reason people buy and iPhone without understanding the consequences.1. Flipkart/WS retail maybe partially responsible for shipping out a faulty product. The same happens even when you buy from dedicated physical stores. The core  problem lies with Apple and Apple has very smartly distanced itself from the post sale affairs -especially in India. I am giving this feed based on what I've observed...READ MORE,negative
"There is a price drop of 2500 Rupees just after 2 days of my purchase this is absolute mockery for the customer, I will never ever return to flipkart for my next purchase. I would like to give ZERO Star for flipkart and the seller but no option for it so I would go with a generous 1 star The phone is apple wonderful as usual.READ MORE",negative
"This phone is nice, compact and easy to use. If you are bored of using android devices and want some rich user experience then this is great option at reasonable price.Pros:1. Easy to use handy phone2. Good rear camera3. Got latest updated of ios 10.2.1Cons:1. Rear camera is only 1.2 megapixel2. Small screen size so won't be appreciated by allREAD MORE",positive
"!!! I am Using this Phone Since May 2014 as Primary Phone !!!I have iphone 6 & 6s , but this is my Personal Favorite.----------------------------------------------------------------------------------------------------------------------------------------------------Please Read Complete Review, it will Help You to take a Decision if you are Planning to Buy it in 2017.-----------------------------------------------------------------------------------------------------------------------------...READ MORE",positive
Nice phone n good deliveryREAD MORE,positive
Delivery: On time and good packing.Warranty: Checked the serial number on Apple site and no problem with 1 year warranty from the date I activated phone.Performance: 10/10Stability: 9/10Consistency: 10/10Looks: 10/10Sound: 9/10Camera: 8/10Design: 10/10Privacy Control: 10/10Battery Backup: 7/10Compatibility: 2/10Overall: 8.5 out of 10.(+) Performance - Apple designs both hardware and software so even the seemingly ordinary specs deliver vertex of performance.(+) Stability - No...READ MORE,positive
"before ordering this phone I was little nervous because my earlier experience was not good with buying mobile phones online ..  But fortunately this one is not like that 😊😊 I,m enjoying  my iPhone.. Finally  a proud owner 😇Thank you  FlipkartREAD MORE",positive
I got this phone on 13 Nov 2015 and till now it is better to give a review. I got this at 26200/-. I brought this iphone 5s(space grey) as i got the manufactured october 2015 version and inbuilt ios 9.0 which is fluidic and superb performance.Gaming is superb and battery lasts a day long for average users. Camera is 8 MP is the best part in iphone 5s. stunning photos and front camera is as equivalent to 5MP compared with other phones.I upgraded to ios 9.1 and its still working fast and flu...READ MORE,positive
"This is the fastest smartphone ever.Speed that Samsung provides in their quad core and 2GB phones, iPhone 5S has double speed than that even though its 1.3Ghz dual core with 1GB RAM. It clarealy states that who is ultimate winner and who is best.If you say about price then Samsung sells its plastic phones at 40 to 47K where Apple sell alluminium body iPhone and an awesome looking phone at 53K so thats obivous its price going to increase.Have you ever seen people waiting for Samsung phon...READ MORE",positive
"Delivered on before time excellent team. Really feel very happy to say this nice packing and nice stored. No heat, no hang, excellent take care flip-kart....... Keep it up team as the futureREAD MORE",positive
"Awsome is the word to describe the overall experience.Bought it for my wife. Both of us have been iPhone users. She is pretty happy to upgrade to this model. Suits her requirements. Easy to handle, intuitive, beautiful et al...READ MORE",positive
"I ordered Iphone 5s from Flipkart through Ws. Excellent service with next day delivery. I was aware if the tampered seal problems with the box. So, i minutely inspected to see the seal for tampering. But, the phone all accessories were genuine. All was there. Phone works great for the last 3 months. No complain. So, i think people who are not happy with the service might have had Bad luck. I am very happy. Thanks Flipkart.....READ MORE",positive
"The phone is premium to hold and its very light (112g). The Gold color is awesome and IOS7 makes the phone even better. Battery will last for a day if you use the phone on WiFi, if you are using 3G then it would be 10 hrs max.The phone charging is superfast, as the name suggest its a lightning charger, other than this the phone has all of APPLE's propitiatory features. The Touch ID is good but i don't find it amazing and its not worth the reason for the phone's cost.The phone is insanely ...READ MORE",negative
"* It is very expensive, so if you don't have enough money don't go for it.* Purchase 32GB version, 16gb is pretty less for anything (don't forget only 10gb is free).* No phone in this world (Including Galaxy S5 and LG or whichever) can beat this awesome machine. ( I dumped my S5 recently).* iPhone may not give you everything (atleast till iOs 8 releases) but whatever it gives you blow your mind away.* Perfection in each and every details is what makes iPhone stands away.* Just readi...READ MORE",positive
"I don't think I need to say anything about the phone, those who love apple products will always love them and those who are ignorant would continue to chant Android! Android! Android! The handset shipped is genuine, very well packed and was delivered to me in less than 24 hrs. Flipkart never seize to amaze me!P.S. - The phone comes with preloaded iOS 8.2 :)READ MORE",positive
"Hi,Its good there is no great features as i took and i looks like normal smartphones and nothing special except the desgin graphic and processing speed.READ MORE",negative
"Being an iPhone user earlier, i did not have even the slightest of hesitation in going for iPhone again. But I was little skeptical about ordering online. Some of the reviews posted were pushing me even back. Finally after realizing that I could not get it any cheaper from other vendors/other portals (At least not until iPhone 6 or 6 Plus is available in India), I decided to take a chance and order.Ordered at 11:00, had my phone at 16:30, same day. Excellent service from WSRetail. Packaged ...READ MORE",positive
"Just as expected apple is certainly living up to their mark. Great phone. And thanks to flipkart for one day delivery.Its an awesome phone to invest. People who doesn't like Apple,  will say different stories about it. But I would suggest go for it. Its worth investingREAD MORE",positive
i purchased iphone 5s fron ws retailer . the delivery was late as expected but the packing was good and i loved my new iphone. it is truly awesome and the phone was in its best condition nothing better can be there.................READ MORE,positive
"Apple will have to overcome the weight versus power problem effectively through energy efficient hardware and software that effectively reduces and simplifies the processes and works smartly by switching on and off peripherals and antennae when not needed and needed. Unless improves this, Apple will become one of the android family smartphones which is also severely impacted by this problem due to lack of control on hardware produced by many of the manufacturers.  Having software and hardwa...READ MORE",negative
"Bought it the day of its launch. Now after 1.5 months of using it, I can definitely say I love it so much. iOS7 can be a little buggy sometimes, but the phone is an absolute joy to use. Great battery life as well, easily lasts a day and if i am careful by not playing heavy games then lasts more than a day. My previous phone was an Xperia S with pathetic battery life. The camera is amazing as well and the touch ID really works. The only problem with touch ID I encounter is when my hands are di...READ MORE",positive
forward thinkingthe iPhone 5s comes with stunning unibody design that you love to use and new A7 processor it so fast and i also playing infinity Blade  3  game on my 5s its awesome  apple also include  M7 coprocessor specially for Motion tracking that means its tracks you daily move and nike is develop very good apps so u get advantage of that.fingerprint sensor Touch id-after successfully  configure new bio matric security so incredible your use four maximum fingers for un locking your...READ MORE,positive
"If yo can not understand the power of ARM Cortex A15 architecture base quad core CPU then Babaji ki thallu and S4 has no differences. Hi, I bought the iphone 5S on 11th Nov 2013 from Kolkata I got the Space grey 16GB version. It was a hard decision for me to say good by to android. As I was using galaxy S4. It was definitely a great performer in terms of multitasking and gaming. But I was really tired of the plastic phone. I was thinking about the Note 3 its looking good with leather like ...READ MORE",negative
"I am using this from 3 months. Excellent Speed, performance, battery life is decent.Absolutely no lag in performance. Camera is good. Very satisfied with IOS. If u compromise in some flexibility, customization then iPhone will be Yours best phone. The best thing I saw in phone was it  works for years as if it was on first  day. But there are still some disadvantages.Disadvantages :-            1) We can't backup or share apps as we do in android           2) We can't use other android ph...READ MORE",positive
"pronlike it very well , it has very interesting features , looking lovable gadget , the manufacturing perfection very excellent, to use this gadgent is very cool, consBut i have no money to buy this, i use this with my friends apple 5s, so why i write this review , my dream to buy one 5sREAD MORE",positive
"I give it a 4 star because of it low memory of 12.5gb.You come here for reading reviews!.. LOLCom'on man it's an Apple Device.. Its a very good device with a perfect size. Feels great in the hand also felt great from the core of the pocket money.However for a Android user planning for a change this a great device. 'Lags'- don't ever think of it for normal use like chatting, listening to music, shopping, and calling obviously. Battery lasts for a day long with a decent use.I liked it ...READ MORE",positive
Nice phone. The best part of iPhone is that it never hangs. I had a bitter experience with Samsung. Then onwards I am loyal to iPhone. According to me this is the most beautiful phone in the world. iPhone is always a smart buy. Limitations are certainly there but it gives you peace of mind in respect of performance. Even premium devices of android hangs after one update. So go for it. Flipkart is the best in respect of delivery and return.READ MORE,positive
"I had a iPhone 4 for last 3.5 years and used it without a single problem. Although it had no issues started to feel the urge to upgrade. Was trying to wait for iPhone 6, but took the plunge and got myself this. I have read reviews that the touch ID has problems, but i have not had any issues with one week of usage. It works like a charm. It is how you set it up. Zero lag and super snappy. I dont go with amount of RAM of how many cores a phone has. After a short stint with Scamsung (typo was i...READ MORE",positive
The product was shipped in less than 36 hours. It was Brand New iphone 5s totally in  sealed condition. Package was very well packed.Delivery was spot on. And delivery boy (ekart wish master - Mukesh) behaviour was extremely joyful and pleasant. Wish him a very good future. Thank you Flipkart and  ekart.READ MORE,positive
I received the iPhone before the estimated date .I am very much happy with the services provided by the flipkart .iPhone e is very good for the business people and it looks great .A brand new piece manufactured in this year and so happy about it .Immediately received 0s 9 update immediately after started the phoneREAD MORE,positive
"iPhone 5S has only two new feature that are worth noticing, the touch ID sensor and the 64 bit architecture, there are phones on the market which are much cheaper and are more powerful. For e.g. The LG G2 or The Google Nexus 5.Even with the disadvantage of the N5 and G2 not having 64 bit architecture they can still easily match up against the 5S. Not only is N5 significantly cheaper it's only flaw is its 2300mAH battery, whereas the G2 has 3000mAH battery and is much more powerful compared to...READ MORE",negative
Idiots who hate this phone understand that the iPhone is the best phone. Grand can be 5 inches and for those who use it I wish them good luck to handle the phone in one hand. The look and feel of this device is great. The OS is a major improvement and it has many more features. People don't think it has a waste camera just because it's 8MP. Apple does not increase the no of pixels it increases the sensor size thus making pictures even better wit better detail. Flipkart don't stop selling this...READ MORE,positive
"After two years they put virus bug while updating latest software version and make them useless mobile (all companies do the same thing). better buy low budget phones, if not working we can exchange. All phones worth two years only. Note : Don't update software version when they give popup.READ MORE",negative
Bought this phone 2 days back for my brother as a birthday gift. Phone seems like a refurbished phone. Phone needs to be in full recharge 2 times in a day. If I open only what’sapp and fb in net the phone battery draining out. We are buying the item thr flipkart so these people and dealer should be responsible for refund they are asking us to talk to service center and I don’t understand why we need to go to service center for 2 days old phone. If I leave my phone with service center and they...READ MORE,negative
"Dear Users,I totally understand that iPhone is expensive. I own iPhone 5S gold 64 GB and its toitally worth the price.. every little cent. Can you tell me one android phone that does not hang while multitasking. iPhone does not.. You can work on it for hours. And battery life is much better than Android. I used Galaxy S3 and then Note3 now its Iphone. Out of all, I find iPhone 5S the best. Also I noticed that iPhone 5S camera is 8MP while Note3 camera is 13 MP, and I say, the picture qual...READ MORE",negative
"After 1 month of use Here is genuine review.1. Positive points :Display and ios operating system is awesome, camera is awesome, low lights photos are also good. Full metal body look classy. 4g jio sim work good.h headphone provided have very good sound.2. Now negative points :Battery backup not so good, tower reception is also weaker then other smartphone, speaker volume is bit low,4 inch display feel very small after using 5 inch display before, storage will not feel sufficient for more...READ MORE",negative
Apple was once known to be an innovating company in terms of design and tech in their products.That name is now all but gone now a days.Iphone 5S is yet another eg of the company who can no longer really innovate.What does this have for it to be priced at Rs.53K that too for the 16GB verson (32 GB is 62K).Lets take each feature and component of the phone and do a comparison with the competition.Camera This is one of the most used part of a smart phone.Apple itself has prided in its camera...READ MORE,positive
"If you research well you will get aware of the fact that this is the only phone right now which gives unique hardware and software future which none other competitive phone does. Touch ID is definitely useful and practical and very lovable. The phone works very well under any stress and is fast as light. I would say ""This is one of the device of your life, which you cannot skip to buy. It is the final solution to all your mobile needs and problems"" and I stand by that forever.READ MORE",positive
Excellent phone Sound clarity is very good headphones also Nd good camera I was buy last yer June I keep still newREAD MORE,positive
