review,sentiment_label
Very nice looking piREAD MORE,positive
Very good phoneREAD MORE,positive
Value 📱 for money 😌👌🏻 Awesome camera performance ❣️READ MORE,positive
All photos clicked in 50mp mode at night Happy Navaratri 2022READ MORE,positive
very nice phon....... i love ❤ samsung™...READ MORE,positive
Awesome cameraREAD MORE,positive
This Product is Too Gud Thankx FKREAD MORE,negative
Overall phone is excellent if you’re looking a Samsung smart phone in this price point then go for it. specially thanks to Flipkart to deliver this product on time.READ MORE,positive
"In this prize awesome 5g mobile, Camera is good.READ MORE",positive
Camera is awesome 👌 I like it and battery  is well not comfortable in side fingerprint sensor and other is good 👍 😀 ....READ MORE,negative
Looking so beautiful 😍 🤩READ MORE,positive
Back Camera is good enough in good lighting condition. But front camera needs improvement.READ MORE,negative
Review After Using 5 Days:1. SD 750 works very well and give a very good performance2. Fingerprint Sensor is very quick and responsive3. Camera is not up to the mark. Many other devices in the same range perform very well comparatively.4. Charing adapter not provided in the box. Gives a bad impression. Although the device supports 25W. See below the charging speed analysis.5. Samsung Keyboard's haptic feedback is awesome. I have not tried any other keyboard.6. Knox security present7. ...READ MORE,positive
BestREAD MORE,positive
Camera quality is so good...READ MORE,positive
Always be like 👍 Samsung mobile 📲 My experience Samsung Always time goodREAD MORE,positive
I like the overall phone in this price range. Camera is quite good but it can be improved. Good battery backup and display.READ MORE,positive
Front camera selfi 8 mp goodREAD MORE,positive
Nice design and camera quality is good.READ MORE,positive
The phone is fantastic. Have good camera. The clarity in picture and sound is superb. Feels bit heavy compared to other phones. But it's value for money. Phone with good features in a very competitive price.READ MORE,positive
niceREAD MORE,positive
"After 2 months of use security, Battery backup, Display, performance, storage capacity, front camera all are fine but back camera is too worster then worst...That make me so said on samsung mobile. My small request to samsung to improve the quality of back camera..READ MORE",negative
Nothing to Say it's Simply SuperbREAD MORE,positive
Best Camera QualityREAD MORE,positive
GoodREAD MORE,positive
Pretty good camera especially in good light condition.Battery is good but the charging speed is too slow.Display is good.Overall decent product for daaily usage.READ MORE,positive
"Others company smartphones,Tha best smartphone SAMSUNG.This is tha brandREAD MORE",positive
"Pros and cons after two days of usage* Display is good, won't bother you much despite being a TFT*Finger print scanner is not very accurate, won't unlock the device some times*Day light pics of the rear camera are good, wide angle also works well, selfie camera at 8MP is average, night performance of both cameras are average. * Face unlock also shows some glitches*Battery backup is good, at moderate usage, lasts 1.5 day easily*Sound of the device with a single speaker is good*Security...READ MORE",negative
Cooper blush colour is looking awesome 😎. Overall performance is good.Some lag I can see in this processor.READ MORE,positive
Good mobile in value of money.Camera super Good performanceREAD MORE,positive
Nice looking.👌READ MORE,positive
"This phone is a good choice It is my first samsung phone and I'll say I am satisfied enough till date . It's camera quality is good , the colour contrast is good and videos are stable but not 60fps . It's battery backup is real good lasts 2 days with 80-85% charge and Charging is also very quick ..I'd say go with this phone !READ MORE",positive
Best product at this price... No other companies are providing so many features in this price range with top quality. 5 friends 5 F23....READ MORE,positive
It's very good product  .value of moneyREAD MORE,positive
NiceREAD MORE,positive
Beautiful experience 👍READ MORE,positive
The performance and display is very good..the camera is better as compared to its segment. battery is decent enough for a full day normal use..READ MORE,positive
Goods camera and i'm impressed. Thanks for thisREAD MORE,positive
Awesome mobileREAD MORE,positive
Glaxy F23 5g verry nice photography and videographyREAD MORE,positive
"Review after one week Battery life great..Use 25W samsung charger for good charging experienceCamera is pretty good 50mp gives good processed image.Video stabilitization is good but reducing quality.120Hz display is fair enough,but amoled is far better.Snapdragon 750g is good also giving quality performance for gaming Like BGMI.READ MORE",positive
Amazing camera in this range phone...full marks🤩🤩READ MORE,positive
NiceREAD MORE,positive
"After using this phone for more than a month i think i am qualified for giving an honest review about galaxy f23 . Cons first.1. Buetooth gets disconnected every 15-20 minutes   automatically, it will pass you off.2. Not giving adapter is another dumb idea.3. Fingerprint sometimes doesn't work..4. Front camera is not as expected.Pros:-1. Look is awesome. 2. Battery 🔋 works fine.3. Speaker works fine.4. Back camera is awesome.5. Internet works more than fine.6. Frequent softwar...READ MORE",negative
"First up all it was samsung product, so dont worry about display. display having tft panel but color accuracy is more better than other chinease brand. Camera is decent type. Perfomance wise there was not any lag smoothly operates any thing. Thanks for snapdragon 750g. Software experience was amazing with oneui4.1. Afterall it was amazing product from samsung. Thanks for flipkart for such a wonderful deal. Some camera samples are added below.READ MORE",positive
GoodREAD MORE,positive
In love with this phone. 😍 My first Samsung phone and it's really worth it.Bgmi Cod Asphalt all are running smoothly on this device.Made a great choice thanks flipkart.READ MORE,positive
All time Samsung lover Since 2016 buying J7 and in 2022 I purchase this phone F23 5G.Excellent phone with Snapdragon 750G.Best phone under this budget 6/128GB with 5000mAh Battery.READ MORE,positive
NiceREAD MORE,positive
GoodREAD MORE,positive
"i am a huge fan of stock Android.This is my first Samsung phone. My biggest concern while purchasing was the annoying apps that will come with the phone, and whether i would be able to remove them. No surprises there were quite a few useless apps, i was able remove some of them, but not all. initial setup was a minefield of ""i accept"" subscription from samsung which i tried to carefully avoided subscrbing to. Camera: Quality of images surprised me. i was not expecting this quality. it is no...READ MORE",negative
"Good graphics of the phone , nice camera 📷 quality , good storage, good network quality, 5G network phone , good picture quality, low pitched volume and my money is used in good thing.READ MORE",positive
Guys it's an awesome phone. U must try this one. Although it doesn't provide charger with it but doesn't seems anything to worry as u can order 25W super fast charger which this system supports.READ MORE,positive
"Love the color design speed battery life and everything 😍 it's just awesome guys go for it, don't fall for bad reviews they are just trying to get ur attention 😀 For the price it's more than enough.Will test more and come back. DO LIKE SO THAT EVERYONE WILL GET AN IDEA¹🙂READ MORE",positive
"Really loved the colour of the phone, it gives a premium vibe. Considering the camera only 8mp,it is way better than the camera of any other brand providing around 20mp with effects. Samsung's camera does not uses extra powdery effect and keeps the face natural like you are viewing in a mirror. It has a feature to click selfies by showing the palm, and it clickc a pcture within 3 seconds. Apart from that there are many features and modes provided in the camera. Back camera is also too good. ...READ MORE",positive
"First of all, this is a Samsung 2022 5G phone.Pros:1. Android 12 with Oneui 4.1 out of the box is extremely good os, feels like a flagship.2. Call recording without announcement.3. 5G ready with 12 5G bands4. Rear camera is very good. Ultra wide cam is also usable.5. Processor SD 750G is extremely fluid and doesn't throttle or heat up even in summer.6. Battery 5000mah is just awesome. I charge with Portronics 18W charger which takes less than 2 hr to charge.7. Display is TFT LCD but b...READ MORE",positive
Good product.Front camera is 8mp but quality is very good.display is very good & 120 hz is so smooth to use..READ MORE,positive
Great productREAD MORE,positive
"At this price it is Very good and excellent smartphone, Go for it guys,Amazing performance After use it for 30 days i feel this phone have a  decent camera, Overall good display, Nice 10-12 hours backup battery, no doubt very good performance, it is Wonderful budget phone of samsung ,Highly recommended at this budget.READ MORE",positive
"Very good camera,READ MORE",positive
This phone is nice 5g smartphone.READ MORE,positive
This is extra cost mattering product.Charger adopter is not available with this product.Very badly and sadly refund is not available for this productREAD MORE,negative
"Budget Phone, outstanding performance.READ MORE",positive
Good very good producktREAD MORE,positive
"The 25w works so well Phone is so smoothBack camera is not that good(3) but good for nature photography but selfie camera is great(4.6)And stabilization is damn smooth Its been a month and i am not facing any leg gaming  is also smooth Overall its a good phone just a little costly ,if charger was included in this price than it was going to be okehREAD MORE",positive
Samsung owsmREAD MORE,positive
Amazing phone under 15kREAD MORE,positive
Product is good but one negative thing about this phone is that 5G update is delayed.I have purchased F23 5g phone in Oct22 but stil waiting for the 5G update due to this issue I am not able to use 5G service in 5G phone. This is disappointing.READ MORE,negative
Best 5g phone with 12 bands snapdragon 750 g chip 6 gb plus 6 gb total 12 gb ram big screen cool design 120 hz refresh rate totally satisfied run like hot knife on butterREAD MORE,positive
Very good performance . Loved it . Nice camera and good battery life . But main problem is that it doesn't come with charger and I had to purchase it separately which costed me 1.3k. Rest the display used is tft which I didn't expect in such a price segment device specially in samsung which is known for it's display ....READ MORE,negative
Good for studentsREAD MORE,positive
The best product...with lowest price good camera  coliti and also smoothness..I love this productREAD MORE,positive
"Excellent smartphone in this segment absolutely great performance, nice camera, long lasting battery and most important amazing UI. And whoever were saying the panel is TFT let them be becauses i found this phone's display pretty much good over IPS panel the brightness is eventually more than ips panels.READ MORE",positive
What a camera. Worth of money. Every body like the camera quality. By d way Samsung is always Samsung nothing like Samsung.READ MORE,positive
Not bad at this price rangeREAD MORE,positive
"*Rear camera does an excellent job 5/5*Front camera 3.5/5(soft images lacks details but enough for an average to good user)*Display 5/5(TFT doesn't matter)*Battery life 4/5*Software 🔥🔥*Use a PD charger to charge the phone, 33watt poco, Xiaomi charger will also support*In hand feel and looks were on point.READ MORE",positive
Brand value but cost wise little expensiveREAD MORE,positive
It's awesome to use Samsung 👏 phones and kuddos to the greatest and lightest one ui being and midrange phone it misses only charger rest 120 hz display is not amoled still it's IPS but still it awesome and snapdragon 750g is such an innovative and insidious SOC by awesome gaming experience but there is a catch it's only 60 fps then camera are average hope u agree with my point 👉 Still 50 MP doesn't takes very good 😕 pics Then we have 2Mp which is not at useful macro camera 8MP is not ba...READ MORE,negative
"Nice phone, awesome 👍,Go for itREAD MORE",positive
NiceREAD MORE,positive
In love with this phone. 🥰My first samsung phone and it's really worth it.Bgmi cod asphalt all are running smoothly on this device.Made a great choice thanks flipkart.READ MORE,positive
Samsung design is looking niceCamera images is clearValue for mony all over is bestBut front camera 8 MP and Display TFTNo add charger in the boxThanks flipkart timely deliver aqua blue color is looking beautifulREAD MORE,positive
Nice Product.READ MORE,positive
"I always used flagships like Galaxy S series or iPhone ..always high end ..now time came where I found really good phones are the ones which are in the middle of segment...belive me F23 5G is hell of a phone ... superfast ,no lag whatsoever, with 60ghz is way to fast ...and switch to 120 ghz it's blazing fast.... excellent camera (After recent software update) ....Go for itREAD MORE",positive
This is best 5g phone on this prize range ❤❤👍READ MORE,positive
Phone is good ... in this price range samsung phone is good .. 👍READ MORE,positive
Best phone ever i usedREAD MORE,positive
"Best one this price range,go for it 👌Powerfull prosseser,longlasting battery, lerge display,camera is good and also butter smooth surfing.im happy with product, thanks to flip kart.READ MORE",positive
so far so good :)READ MORE,positive
paid 550 extra for charger and cover... however it's original from SAMSUNG..SAMSUNG IS INVOLVED ESTABLISHING 5G network in India... from 15th August 2022 5g will be in India let's hope Samsung phone work with 5g??READ MORE,negative
I order samsung galaxy f23 on may 12 and this review is after one day of use and it started heating on the first day even if i used it normally it was heating even when i just booted it performance is decent when u use it but when u keep it aside for just 10 min and again start to use it it feels like its hanging and all the apps goes black for a minute not expected from samsungREAD MORE,negative
This Green colour looks Awesome Generally we use primary camera more so its best in that segment. Battery charge & discharge excellent...supports 25w its good..full charge in 1&1/2 hrDisplay is goodSingle speaker but loud enough 12 5g bands great! triple sim slot- 2 sims & 1 sd card support On the top Samsung UI - lovely performance 2 years of andriod os updates & 4 years of security updates which is very good.Thats all in the end its a good phone. you can choose this instead of othe...READ MORE,positive
"Mobile was just ok,I expected something  more with these specifjcations,not expect too much ,it's just a drcent performer..READ MORE",negative
It was very goodREAD MORE,positive
Superb touch nice battery nice camera go for it. You will not regret.READ MORE,positive
GoodREAD MORE,positive
It's really niceREAD MORE,positive
After recent update phone is working properly..READ MORE,positive
Super camera 📷READ MORE,positive
Product is good. But without chargerREAD MORE,negative
Everything is good except the charging adaptor and camera quality. Specially the camera is not upto mark. Camera quality is just okay neither too bad nor too good 2.7/5 stars.Also note that as this model is very new. So back cover is not available in market easily.F23 photos are not sharp and crisp. Poco was better. I had bought the phone and camera is not good. Xiaomi and poco vivo are offering better camera. You have to make a choice between processor vs camera. If you want camera then do...READ MORE,negative
"It's a good 5g device with decent battery backup along with nice back camera.Display is good in comparison to tft ,the performance is too good in this price range.Love this product.READ MORE",positive
Overall phone was good for normal usethe worst part is the display not at all good in bright sunlight outdoor use Camera works average but the samsung adds it's customization to improve the imageREAD MORE,negative
"Just the best product for my dreams. 5g,  Dual sim, hours of browsing, fantastic camera, extended memory support,  good network capturing, high speed, zero hanging!! What else one could imagine for this money.. made for India i may say.READ MORE",positive
"Waste mobile in SAMSUNG. networks signals showing one to two points in the mobile at that time if any one calls it saying that mobile is switched off or mobile under not in network coverage or getting busy tone. very very waste product, If i put the same sim in another mobile it's working fine under same network. I am giving this review after using two months of this product SAMSUNG Galaxy F23 5G. And some times dual sim not works, Wifi range is also very less(It is not showing the list of wi...READ MORE",negative
I am writing this review after 1 month of use. A very good phone from Samsung at this price I just loved it the overall performance is very a. This is a very good gaming phone whoever wants a good gaming experience they can definitely go for it. But the only disadvantage is that u have to buy the charger from outside.READ MORE,positive
Kdkk look Iam happy for thatREAD MORE,positive
So Beautiful LookREAD MORE,positive
"Full star for my phone. This is my first Samsung Phone really satisfied with Camera, Battery, Display and Performance. In this budget it's really worthy.  Don't think too much just go for this.READ MORE",positive
I'm using intune software in this mobile its not working properly not suitable product for IT peoplesREAD MORE,negative
Nice selfieREAD MORE,positive
Awesome Phone just average 😚READ MORE,positive
The perfect phoneREAD MORE,positive
There is no charger available and no return policy its manipulate to customer please don't purchase any one this mobile and shop on Flipkart Flipkart also change his speak please humbel request don't purchase this product it is very very bad thinks please don't purchase this productREAD MORE,negative
"This fool's are selling fake Product, F23 model they don't show in exchange. Friends I am last 13 years I am using SAMSUNG mobile only. First time I understand that I don't want use this productsREAD MORE",negative
"Very Good Phone , worth for money Performance is too good no legBattery is good120 hz display so smooth and brightness and color is goodSound is good No any heating issue ......Happy to useREAD MORE",positive
Nice phonesREAD MORE,positive
Performance not so great few apps are damn slow in new phone of 6gb also. Very slow with mobile data and somehow OK with wifi.Another interesting fact - Why a phone WITHOUT CHARGERREAD MORE,negative
"Everything is good love it this mobile battery 🔋 backup, display very smooth camera also good &5g value for money go for take.READ MORE",positive
All is well except that this phone is NOT supported  by airtel 5g. As per airtel website this model is not listed under compatible phones and also not listed under phones waiting for software updates. I'm currently in a city which has 5g plus (JUST LAUNCHED) but still not able to use .i bought this phone with a lot of anticipation for using 5g but I feel it's a letdown.  I have to wait till 5g is officially launched in all cities without choice. Give a like if u like this reviewupdate on my...READ MORE,negative
Amazing Deal with Flipkart.READ MORE,positive
"To be honest , dint buy this mobile or any samsung mobile as they , don't provide charger adapter , and you fall in trap .They will say of giving charger adapter coupon, but will not give and you have to buy it seperately at a high price , so this is not worth it . Don't buy this phone , i also fell in trap.READ MORE",negative
At this price the product is really very great.It comes with 6gbRam and 128gb Rom and alsoThe snapdragon processor 750.How can i forget about the 5G Network 😁READ MORE,positive
Very nice productREAD MORE,positive
Display is decent but the camera and specially ultra vide is really superb and the performance is to good with Sanapdragon 750g but the face lock is very slow overall worth your moneyREAD MORE,negative
"The product is new, so we don't get back cover in the market.... so plz provide charger and back cover with the box.... otherwise phone is good with this price...Due to super fast charging the little bit heat will charging otherwise mobile superb....READ MORE",positive
This gives us very wonderful performanceREAD MORE,positive
"Okay 👌 good mobile and future, ok for price, but adopter is not provided this mobile so disappointed. Other than ok for productREAD MORE",negative
A perfect phone with excellent features 👌. Loved it thoroughly ❤️ !!READ MORE,positive
"This phone is purchased before 2month..Now a condition is very good..Only think is display ..this display is fhd+ ...suppose this will be amoled display means, this is fantabulous...READ MORE",positive
Phone performance is good but camera quality it OK and battery good display quality nice but some heating issue when charging the phoneREAD MORE,negative
Battery is very worstREAD MORE,negative
Camera is not good at all .READ MORE,negative
Camera quality is very badREAD MORE,negative
very goodREAD MORE,positive
Camera and display very bad this product dont buy this phoneREAD MORE,negative
Camera is good phone is very prettyREAD MORE,positive
Good quality picREAD MORE,positive
"Many people were complaining about battery drainage and heating issues...i haven't faced any of them in my one week of usage.Camera is perfect at this price range.Samsung ONE UI 4.1 is just best.Display - Obviously not as much good as a Amoled display but still it is nice, bright and clear.Performance is superb...no lags in daily usage (i m not a gamer) ....u can easily perform multitasking and that 120hz touch rate helps in giving a smoother experience overall.Bonus- Samsung's usefull ...READ MORE",positive
Mobile good and camera also good i have used it for 2 days it is fine tq flipkartREAD MORE,positive
"Don't get confused, just go for it 👌READ MORE",positive
BeautifulREAD MORE,positive
A good performer in most segments.Display is real good with 120hz refresh rate without AMOLED.Rear camera is good to go with natural colours in a neat view.Battery stays for near to 2 days with regular activities.READ MORE,positive
"Performance is good, Camera is good , 5G working exceptional. Only problem is heating issues, it was there since I bought this product. Almost 1 year used no other issues other than heating problem. Best product in this price range.READ MORE",positive
I never expect this type of camera quality i am sharing some pics. Performance also too good. No lag or hang issues. Some time finger lock sensor little bit Lagg but overall good. 8 MP Camera quality too good👌 . I like this phone at this price range. Sound quality and vibration motor Performance is good.READ MORE,positive
Nice phone..👌👌❤️❤️READ MORE,positive
Super lovely mobile I loved it value for moneyREAD MORE,positive
"Nice mobile. Little disappointed by 50MP camera b'coz picture quality in not that good ( opinion*- company should have provided 64MP camera atleast). Else things are superb like battery, display, touch,READ MORE",negative
Great productREAD MORE,positive
Like a Dust bin. Photo quality is like just low price kepad mobile phone.READ MORE,negative
SuperREAD MORE,positive
"After 2 days of use i am giving this reviewCamera is good but not very good.Display is awesome, couldn't expect that a TFT display can give a awesome experience of video and graphics. And touch is extremely smooth, it is actual 120hz refresh rate.Battery backup is good.Though it has mono speaker but sound is clear and loud.And processor is First enought to play BGMI in HD and High frame rate.Can play 4k video smoothly.The only issue is no adaptor inside, but charging cable is there we...READ MORE",positive
Nice looking mobileREAD MORE,positive
Awesome camera with 750g snapdragon i give 5 stars for performance everyone has to buy for camera featuresREAD MORE,positive
1 no. Smart phone budget killer Samsung always launches good products thanks to flipkart fast deliveryREAD MORE,negative
Not able to detect 5 G networkREAD MORE,negative
Good phone i will get it 9.5 out of 10READ MORE,positive
NiceREAD MORE,positive
This is best mid range smart phone.READ MORE,positive
"Within few days the display is not working properly automatically. Very bad, no value for money.READ MORE",negative
"Phone has lots of cons . It has issues in delivering basic things which we expect from phone1. It's slow . Even fo making simple voice calls you will feel lag 2. Back and front both the cameras are bad3. Wi-Fi and SIM Internet is slow. BGMI on phone data gives ping of 100ms while my other phones gives ping of 30ms.I had brought this Phone just to have some variety.  So far I've used Motorola,  LG, Mi, Realme, Asus phones Samsung for sure is not what it used to be at dawn of Android era.READ MORE",negative
Battery backup issueREAD MORE,negative
"Reviewed after 7 day usage:The most worst part of my experience is its battery performance, it works hardly for 7-8 hours from 0% to 100% charge. On first day, the battery heated more but when software updation done heating minimised but it heats in charging and a little heavy 2-3 hour regular usage. As the Samsung is telling customer about the battery usage time clarification in terms of 5G network is causing more battery consumption but even on 4 G it does not work good.Camera is not up...READ MORE",negative
"Battery fail , No Adaptoer , unuse mobile , fail series ,READ MORE",negative
all goodREAD MORE,positive
