review,sentiment_label
🤩Phone looking so ultimate ❤️value of money Rs.14999 6gb ram 128 rom thank you for flipkart very to Good offers ❤️Back Camara quality awesome 🙂Front camera 8mp quality not good 😟Snapdragon 750 very fast 😍Phone charge adapter removed very sad news 🙄😥Power on off automaticallyREAD MORE,negative
GoodREAD MORE,positive
Lovely mobile. Day time camera quality very good. Wide angle so love.  Night time better. Mony is very use full. Thanks Samsung. Flip kart very fast in my door. Good service.READ MORE,positive
Device is Real Great for it's price.Many people have criticized it's display because it's old TFT technology but display is quite good and on par with most of IPS displays.Main USP of this phone is it's software. Other brands provide a bit better specs at the same price but they lack on UI and software updates. Samsung is better in this case with regular updates.Samsung pay is really useful and way more faster and convenient to use than any other payment app.Samsung knox security is huge ...READ MORE,positive
Not good waste off money  not good  qualityREAD MORE,negative
Phone automatically start in calls and battery is taking long time to chargeREAD MORE,negative
"Overall a good and nice phone , for whom who are looking for a budget phone , performance , battery  , camera are very good , value for moneyREAD MORE",positive
Good luckREAD MORE,positive
Adapter not there.....charging code is C to C which is not good.  Now we have to purchase Adapter again Rs. 1000.READ MORE,negative
Suitable product for budget range. Product must to contain accesories with pack. Overall satisfied.READ MORE,positive
"Mobile heating issue is there. No charging adaptor in the case.. Also, battry drained up bit early then the actual expectation. I would say go for some other mobiles.. Like Samsung M33 {recent release}READ MORE",negative
Battery and performance are good.Camera is okREAD MORE,positive
"Mobile hang problem. No charger , worst productREAD MORE",negative
"DO NOT BUY IT... You'll regret and will make the next 5-6 years of your life a living hell.The 12k phone I bought 2020 has better camera, lesser heating problem and no lag in performance at all.They won't even return it whatsoever...I repeat it - DO NOT BUY ITREAD MORE",negative
"Overheating issue, worst camera, average UI, No adopter.Very disappointingREAD MORE",negative
My 2nd Samsung mob after years. Old Samsung used to hang so never liked it. But this mob works smooth. Hasn't hanged even once. 120Hz display works smooth it also offer battery save option 60hz display. Display Colour is rich. 8MP Selfi is far better in similar category. Rear camera captur good colors even in night. Speakers sound is good with dolby effect much clear than MI and realme. Looks good in hand slim low weight. Good thing is you don't have keep wiping finger print doesn't stick m...READ MORE,positive
Mobile is good except battery & camera. 1. Many people comment that charger is not given. Yes it's alredy written on website & box. So no issues about charger.2. Battery drain fast. Samsung should fix the battery problem through software update. This problem can be resolved. 3. Back camera is 50 Mp . But quality is not good. So I think physically camera is 50 Mp .so by software update camera quality should also fix .4. Display- I thik this phone TFT is looking better than any IPS & ALOMED...READ MORE,positive
Battery not super proformas & Fingerprint sensor is bad workREAD MORE,negative
Nice 👍👍READ MORE,positive
"After 2 Months of usage,Pros :1. OneUI 4.1 (Amazing)2. Secure Folder 3. Carrier Aggregation 4. Battery Life is Good 5. Fast Finger print scanner6. Top-notch data security ( it's a thing now)7. Pre-installed AR App, you can create your 3D stickers. (flagship phone features) Cons :1. Low wifi connectivity ( maybe with my unit)2. Heats for no reason I've added some pictures, wide-angle, low light ( photo mode), night mode (complete dark), morning light respectively. Good for thos...READ MORE",positive
All over performance is better 🙂 But battery is not better 😔. ar you not a gamers then you buy it   It's best mobile. other waise you ar a gamers then the mobile is not for you .  Battery 🔋 dine first 😔😔READ MORE,negative
"This works Great on each aspect.Front camera will definitely disappointing  if you are a selfie lover.Battery is so good , as a heavy user you will use it more than half  day of continue usage.Screen will give you peace when you touch it .Sound /Voice quality is so high , if you are in marketing job then this phone  voice will give you the satisfaction .One nad things about this phone is  it comes without charging adapter then you have to purchase a new competent adapter for better , fa...READ MORE",positive
Good 👍READ MORE,positive
"Beautiful handset. 25w fast charging, 50 MP primary camera, 6 GB ram, 128 GB internal storage. Latest Android 12. 120 Hz buttery smooth display. Loving it. Only demerits are no samoled and flat back side which should be curvy like any other Samsung set also camera assembly need to go with the body not to be extruded. Anyways loving this.READ MORE",positive
No charger in economic range phone is worst decision ever by Samsung.🙄READ MORE,negative
Dont buy this phone cant play a single  game so hitting phone Carman  quality worstREAD MORE,negative
Don't fall in Tr@p of youtubers. It's really premium phone. Camera display everything. Bezels and teardrop notch hardly mattersREAD MORE,positive
"Good Phone I was very confused by Youtubers about Screen and Camera, But after purchase this Turnup the best one.. Good Camera and Good Screen.. So smooth!! 6 Month back I purchased MI 11lite 8 GB +128 and I am completely Not satisfied duw to hang issues and Camera is pathetic!!! I recommend this Phone over MI + Redmi + RealmeREAD MORE",positive
The battery backup is not good...READ MORE,negative
Very very very good Best soundBest cameraDisplay good Good lookingSlim and best designPerformance is also goodREAD MORE,positive
Although it has TFT pannel but better than other brands IPS pannel. Killer looks 🔥with vfm.READ MORE,positive
NFC feature is very good ..every thing is good one ui 4.1 is very smoothREAD MORE,positive
Very bad experience after 2 months this phone restarts suddenly ....I suggest friends .... Don't buy this scrap from Samsung...If the selfi cam also is improved it will be great even .. ....READ MORE,negative
"Pros- Cam, Sound, Speed, Picture Quality, BrandCons- Battery, Samsung lag, Front Cam, Samsung AppsREAD MORE",positive
Luv with thisREAD MORE,positive
Best in segment at this price point. 😍READ MORE,positive
"Nice phone and fast delivery by flipkart . But one thing is disappointed with the samsung , charger not provided in the box . It's really bad .READ MORE",negative
Awesome camera quality performanceREAD MORE,positive
Nice cameraREAD MORE,positive
mobile is nice fingerprint sensor is working properly...READ MORE,positive
Nice Mobile in this RangeREAD MORE,positive
Battery full discharge within 8hrs not satisfied with this phoneREAD MORE,negative
Absolutely brilliant phone.Better than any chinese phone anyday.My friend bought 21k real me phone with amoled screen which looks much low in quality than the f235g screens.READ MORE,positive
"No adapter with this product ,heating issue,..charging port issue, data cable issue,  After using of 8 month it's waste of money...READ MORE",negative
OkayREAD MORE,positive
It's better not to buy samsung....phone is to dam slow touch is stupid and it's not charging after one weekREAD MORE,negative
Mobile always heat heavily even after charge or if i use for 5 minutesREAD MORE,negative
"Battery charger not included, no USB data cablE AVAILABLE, SO BATTERY IS NOT CHARGING PROPERREAD MORE",negative
Total money waste productREAD MORE,negative
Battery drained very fast.READ MORE,negative
It's battray bacup is very poor full charge battery is discharged within a 24 hoursREAD MORE,negative
Battery very worst 4 hr only back upREAD MORE,negative
Hanging since the first day....auto switch off..battery charging not there many times...poor overallREAD MORE,negative
Not upto the expectationsREAD MORE,negative
Finger print sensor is not working properly. Camera is not good.READ MORE,negative
I like itREAD MORE,positive
"Overall, a great deal.Pros:Snapdragon 750G processor.5000 mAh battery.Great dynamic range of the screen which helps us view a wide range of colour.Corning Gorilla Glass 5 protection.Sleek design and premium look. Hence, a nice in hand feel.Nice in built camera stablization.Cons:Since it is a budget phone, a power brick was expected in the box. So you don't get any charger along. You've to buy it separatly.Phone case is absent too.READ MORE",positive
Nice mobileREAD MORE,positive
"No charger, poor camera and battery drains faster than usual...READ MORE",negative
Battery  backup is very poor ....And selfie camera also pixels are not ok and phone having hanging problem.READ MORE,negative
Very nice mobileREAD MORE,positive
Nice picharREAD MORE,positive
Not worth for money .... company can't able to provide mobile charger.. without charger how we need to charge Mobile...even charger we need pay separate money means why we need to prefer Samsung company..I hate samsung...Don't prefer Samsung ..READ MORE,negative
"I am writing this review after one month so far I didnt found any issues. I received the genuine product from Flipkart. About the product the phone has a capable processor which is SD 750G, its a good processor in this range also antutu score is quite good.Camera is decent enough and Video has stability control feature which is very good.Display is good for indoor not for bright sunlight  atleast Samsung can give AMOLED display in this range. But it has 120hz gorilla glass 5 and it works...READ MORE",positive
bro awesome product . buy it if having a budget <20000. TFT display not an issue. cameras top notch. little bit big screen. processor best. notch is outdated. best design.READ MORE,positive
Charger not available with mobile and C to C charger Not available in market.READ MORE,negative
It was a amazing product in this price rangeLove to use it.Only one thing that i am missing is charger in the boxCamera superb 👌Battery amazing 2 days Battery backup Happy with the product Go for it.READ MORE,positive
"First of all the colour of device is awesome. Gives a Premium look. Camera is good enough for lovely pictures unless you want to do Prussian photography using this, the cameras do a very impressive job. Display is not one of the best from Samsung, but you get 5G with this device, which is cool at this price point. Battery backup and fast charging is reasonable.. the speed is also commendable with one of the best processors inside, definitely a convincing device to buy.Not a hard-core gaming ...READ MORE",positive
"This device provides premium user interface and refresh rate is kinda mesmerizing while there is a missing of amoled display. Battery is literally weak and drains quickly eventhough it is in its early stage. I don't know how battery will perform after a couple of months. Samsung met its audience's expectation of camera without any doubt and I am in love with it. Its camera is way better than that of poco, realme and redmi. Finger print sensor also works pretty well but proximity sensor is no...READ MORE",negative
Value for money 💰READ MORE,positive
GoodREAD MORE,positive
Flipkart is very puvar... apps don't bay... this application... otherwise very bed experience...Delivery... and replacement not giving... 5...to 10 time contact but not solutions over problem... very bed... applicationREAD MORE,negative
Not up to markREAD MORE,negative
DON'T BUY THIS PRODUCT Charging socket issue in this product 25w charger is not working.READ MORE,negative
Camera quality for video calling is very badREAD MORE,negative
Just Awesome Better Performance 120 hrzREAD MORE,positive
Don't go for it. Giving the review after using it for more than a month... Pathetic battery backup having no gaming apps and minimum usage of mobile... Need to charge twice a day... 100% battery becomes 0% in just 8 to 9 hours...READ MORE,negative
Performance not for snapdragon 750. It's working like 660. Very worst PerformanceREAD MORE,negative
"not good, display lags a lot, Screen freezes....READ MORE",negative
F23 Is nice choice performance snapdragon 750g 8nm processor display is soo good  I am not except good display but i am wrong display is too good internet speed is so fast battery backup is so good 8hours battery running design & look is soo better I am take 4 star this deviceREAD MORE,positive
Simply Superb. I love ❤️ Samsung.READ MORE,positive
"I brought samsung f23 6GB RAM version.I am speaking from my personal experience. 1- Has 4 years of software plus security updates with Android 13 and 14. 2- At this price you can get full fledged version of One UX plus UFS 2.2 (most come with UFS 2.1 at this price).3- Also the superb build quality of a A series device, and the TFT LCD panel is not any less inferior to IPS LCD, it supports HDR video, has 240 hz touch sampling rate, 120 hz refresh rate, Gorilla glass 5 and 600 nits of br...READ MORE",positive
No fast charging- it takes almost 3 hours to get fully charged even if 18V adapter. Hangs a lot..Would suggest to go for another handsetREAD MORE,negative
"After one month normal use(***Not Played any game yet***)Bad Exp.1. Heating Issue.2. Too Slow.3. Bio lock is terribly bad4. Face Lock not good5. During call when we hold  phone near ear , screen remain active 6. Touchpad is worst.(for big icon no issue, but u can't click small one)Good Exp.1. Charged really fastAverage Exp.1. Battery Average (normal use 12hr)2. Network Strength Average (3. Speaker AverageREAD MORE",negative
There is no any kind of charging adaptor.READ MORE,negative
Excillent and good service this price.READ MORE,positive
Good product 👌READ MORE,positive
"It is not able to connect Jio 5g in my city , as it needs any software update from Samsung. Other phones are working fine in 5g in my city.READ MORE",negative
Jio 5g not working in this phon till now 18/01/2023 don't buyREAD MORE,negative
Pls don't buy this product. Worst experience with this mobileREAD MORE,negative
Jio 5g not supportedREAD MORE,negative
Awesome at all❤️❤️READ MORE,positive
Super quality smartphone 👌READ MORE,positive
Termendous cameraStylish finishing and looks good in handDrfinately go for itREAD MORE,positive
"After 12 Days of Usage, Here iam reviewing it !!Camera 📷 :Selfie camera is Decent in this price range, shows    your original face not fake ones like Oppo Vivo   realme.Back Camera is 50mp but it's not equivalent to a 50mp camera, still works good, details are satisfactory.10x zoom is available whereas only upto 6x zoom     works better.Ultra wide camera is one of the best I've ever seen!Macro camera is only 2mp but better than realme oppo Vivo.Night mode works great!The most pow...READ MORE",positive
In a sentence.This phone is good.READ MORE,positive
Phone gets heated while charging watching movies and also if we talk for some.more time...it's worst phoneREAD MORE,negative
Nice cemora coliteREAD MORE,positive
Probably one of the worst phone I have used ever. I always feel like my phone is Hanging in a garden. Recently changed the charging point as it was not working.READ MORE,negative
"Very good in look, camera is also good, performance is superb. Value for money. Very good quality.READ MORE",positive
Overall very good phone in this price range.READ MORE,positive
"Lot of issues will come from this phone.Aftr one month, when I answered to someone call, voice is not audible. I used loudspeaker to every calls.It's very worst brand.NowadaysREAD MORE",negative
It's a very good phone.... Just wowREAD MORE,positive
Its not a phone. Its a furnace....!!!READ MORE,negative
"Sound quality very low do not buy,  Do not charger adapter,READ MORE",negative
"product quality not satifying, refurnished mobileREAD MORE",negative
Bad products do not buy this phone anyone.READ MORE,negative
Good phone in this budget decencet battery backup display is tft but good clarityREAD MORE,positive
Very costly cheap productREAD MORE,negative
"Software Issue. Phone Hangs a lot, memory management is not good so apps are taking a longer time to open, Fingerprint sensor doesn't work at most of the time, also unable to record phone callsREAD MORE",negative
Very worst product can't buy this productREAD MORE,negative
phone auto restart a lot.... battery draining fast.....apps got closed automatically.....not expected this from samsungREAD MORE,negative
"Worst experience with this mobile. Problem withBluetooth & wifi even for shoter distance , call connecting ,  display blinks up very slowly .....Moto mobiles r better than these mobiles .....READ MORE",negative
It is worst phone ever.Phone is automatically restarting. This Phone has ram problem.Phone is haningREAD MORE,negative
"Very disappointed 😞 performance from the product,Don't buy this product. Waste of money💰READ MORE",negative
Camera is worst I never commented any product this mobile was not worth the money.Please don't buy this phone. And Flipkart customer care also not good return the product and thier disconnected frequently.READ MORE,negative
Samsung is good brand that all.. but it's fuction F23 lag a lots while using calling or searching contacts numbers or opening any app.. Very slow.. toh it's has 6gb ram..but no use.. really disappointing with F23... I recommend don't but this model..READ MORE,negative
WasteREAD MORE,negative
Poor product west of moneyREAD MORE,negative
Very Bad exchange systemREAD MORE,negative
Bad qulaty phoneREAD MORE,negative
Not goodREAD MORE,negative
Very poor phone company  not replace phone .I have purchased after 2 days phone heating during call very poor phone don't  buy waste  money.READ MORE,negative
This is the worst phone! Never think about it!READ MORE,negative
Mobile is wari hotREAD MORE,negative
Not happy  flikart my father was telling dont order  online   voice is braking in this mobil every min it breack and after 30 sec it come backREAD MORE,negative
Without adapter how to use mobile & charge mobile....READ MORE,negative
Good looks display is evergage..over all good productREAD MORE,negative
Very nice phone ....thanks flipkart😊READ MORE,positive
This is fantastic phone I ever brought this is also a budget phone . I'de like to se the phone like . No phone is best.  This is because it is 5gREAD MORE,positive
GoodREAD MORE,positive
Dear  friends  the mobile  over  heating  problem don't buy this brandREAD MORE,positive
Good mobileREAD MORE,positive
"Without charger adapter and back cover also, Heating  issue also thereREAD MORE",negative
Very good product Good cameraBatteryPerformance120HZ displayREAD MORE,positive
Charging time is very long and Very fast battery down.. very bad battery for this phone.READ MORE,negative
The phone okay CAmera good But prosser very slow I Was using one plus compare to one plus this nothing Just I soldREAD MORE,negative
Good performance 👏READ MORE,positive
"This device not support 5G (SA Technology. Jio 5G), As per discussion with Flipkart they cant do anything and disconnect the call in between call, and As per Samsung Customer Care we ll release the update by next 2-3 months then u ll able to Use. So my Question is that with Flipkart and Samsung If ur device is not supporting such technology then why u are with fake name. very poor experience with Flipkart.READ MORE",negative
"1st time i experience bad performance on Samsung. This is my 14th handest. And I've very very bad experience with this handset. Samsung you think that you are giant of mobile platform, but you have no idea you are wrost mobile manufacturer in india.READ MORE",negative
Over heating issue  hang issueREAD MORE,negative
NOT GOOD I WANT TO RETURNREAD MORE,negative
Nice phone and looks very amazing 😍READ MORE,positive
#Nice  phoneREAD MORE,positive
Great phone at a great value ☺️READ MORE,positive
Camera poorREAD MORE,negative
Best phoneREAD MORE,positive
"Phone was not value for money . For the price when other brands are providing Amoled display samsung is giving TFT display . The speaker is also mono not stereo speakers .and for the worst they have not given charging adaptor. If you only want to have samsung phone just like my mother whom I bought it for , go for it otherwise look for other brands.Display - 2Sound -  3Battery - 4Performance - 3Value for money - 3READ MORE",negative
Camera quality is not goodREAD MORE,negative
Okk qualityREAD MORE,positive
"My worst samsung phone ever, phone switches off and reatarts by itself, power button does not work every time, sometimes you have to press multiple times and still does not work and autometically dials emergency number. Please look for options, sorry samsung but deeply regret my decision to by F23READ MORE",negative
Phone charging minimum 2.5 hours worst system don't buy thisREAD MORE,negative
When phone heats up you can see the drop in performance and even lagging. Rest goodREAD MORE,negative
Mobile is fentastic just no word to day anything wrong If u r gamer like snapdragonsecurity like knox with samsung PAYCamera like 4kDesign like handyDual sim + memory slot5g speed with 12 bandsFeatures like one ui top notchJust go for it without any single thougtREAD MORE,positive
"New model verry nice backup display,back color is verry nice and slim I happyREAD MORE",positive
"Within 2 month of purchase, facing problems in display, battery also not that much worth....very disappointed.READ MORE",negative
"Nice phone ,nice design,medium quality,normal screen,in this price performance was best , overall good Samsung phone , happily buy this phoneREAD MORE",positive
This phone is very good because alot us of features available.and working very fast and it's 5G Phone 📱So I'm very happy ❤️❤️☺️🥰Thanks you FlipkartREAD MORE,positive
Points that I got to know after i bought this and then regretted buying this phone.1. This smartphone DOES NOT have guest mode or other user mode.. this was a very good Android feature that been removed by Samsung.. Idiotic decision2. This smartphone does not have app data disablement completely..it only has this background data off thing..3. Not providing charger is like playing cocky with the customers..also to note Samsung seperate charger would cost you 3000rs approx..so this is the...READ MORE,negative
Worst camera....backup also not good....no charger...don't buyREAD MORE,negative
Front camera very poorREAD MORE,negative
DONT BUY THIS WORST PRODUCT  BECAUSE IT HAS OVERHEATING ISSUE IN  ONE HOUR USE ONLY FROM BACK SIDE. AND ACCORDING SELLERS POLICY CUSTOMER WILL NOT GET REFUND.READ MORE,negative
At this price  this is perfect  perfect phone Here is why1.nfc2. Sd 750g 5g3. Good camera quality 4.5000mah battery capacity 5 120hz smooth display 👌 Cons:1.no adapter  in the box.2. No amoled display.READ MORE,positive
"It looks even more beautiful in person, NFC is the best feature on thisREAD MORE",positive
"I don't understand what kind of USB cable is this and where can I use it, both side c pin provided. Don't expect something like these from company like samsung. Worst experience everREAD MORE",negative
Very good phone. Unbelievable performance.READ MORE,positive
Great job by Samsung... No hang problem.... Amazing display... One of the best phone ever i purchased. Thanks Samsung India. Boycott chinese company. Jai Hind.READ MORE,positive
Issue with heating constantly after using 5minsREAD MORE,negative
Good but without charger like iPhone 😀😀😀READ MORE,negative
"Pros.1. Display quality is good2. I really like the design3. Camera quality is really awesome and impressive4. Speaker output is good (Dolby Atmos works)Cons.1. 120 hz feels laggy (feels like 60 hz)2. It warm while performing small tasks like camera, downloading, 3. It is not a gaming phone (overheating while playing games)4.  I Don't like such notch.READ MORE",positive
Good product... Very Smooth screen..picture quality also good.... Overall valu for moneyREAD MORE,positive
Deal is good Mobile is good But flipkart service is not sufficientTemper box receivedData cable missing And very lengthy process to complaint for that and for the mobile review mobile is very fine working for this price I think it is the best phoneREAD MORE,negative
Bad prodectREAD MORE,negative
TFT display weak battery performance balki phone and no charger don't buy this phone. Network IC is week don't buy this phone processor 750 g underclock poor performanceREAD MORE,negative
Worst MobileREAD MORE,negative
Without chargerREAD MORE,negative
Don't buy this product very very bad product from Samsung very poor quality camera and pathetic display *DON'T BUY THIS*READ MORE,negative
"When charging using 25v super fast charger sometimes shows super fast charging sometimes shows only charging. SD card error was always detected dont know what to do, removed and placed SD card mulitple times but showing error notification.Fingerprint was worse in this mobile always showing fingerprint not clean and display is on for hours which draining the battery.Literally worried after buying this mobile.READ MORE",negative
"This phone captures below average photos with front camera, image processing need lot of improvisations.  Battery is average, performance is good. Overheating is observed often even with moderate usage and while charging. If you Don't have much expectations from camera and gaming aspects you can go ahead and purchase this phone. You would find lot of amazing features in this phone along with the Knox security. Knox security is the only thing allured me to buy this phone that's it.READ MORE",negative
